id	user	icon	portrait	English	Japanese	Final Notes	pic	Filenames	Codes
				"""Cinco Espíritus Silvanos, al cielo volarán, un milagro obrarán, el Trigón desvelarán, ¡la aventura comenzará!"""					
GRAVE_HOLLOWGHOSTTRIGON	The Scythian			Dentro de un árbol hueco titánico, nos acercamos a una tumba solitaria y apareció un fantasma audaz que nos contó algunas cosas.			117	028.jpg	E2A80
				"""Busca una señal de los Espíritus Silvanos y entona una Canción de Espadamancia allí para revelar un Trigón oculto."""					
GRAVE_HOLLOWGHOSTTRIGONCOMPLETE	The Scythian			Dentro de un árbol hueco titánico, nos acercamos a una tumba solitaria y apareció un fantasma audaz que nos contó algunas cosas.			117	028.jpg	E2A80
				"""El canto del Trigón ha terminado por ahora. Me pregunto cuándo volveré a escucharlo."""					
LOGFELLA_LOSTKEY	The Scythian			El leñador afligido conocido como Amileño estaba completamente alterado por algo.					
			AdventureUI/keyItem	Al parecer, Amileño había perdido la llave de la puerta del muro de piedra que bloqueaba el antiguo camino hacia Mingi Tau.					
				"Estábamos como ""¡Uff!, otra misión de búsqueda, ¿verdad?"""					
				Amileño nos dijo que había estado sentado justo aquí cuando cayó en un sueño profundo.					
			AdventureUI/keyItem	Amileño nos dijo que creía haber perdido su llave en el reino crepuscular de los sueños.					
				Ya habíamos oído hablar de los extraños sueños de los montañeses de cabello oscuro del Cáucaso, por lo que esto tenía total sentido para nosotros.					
				Amileño nos invitó a calentar nuestras botas junto al fuego y soñar con él.			63	029.jpg	U2C92
ARCHETYPE_LOSTKEYTHOUGHTS	The Archetype			Pensamos en la vigilia y en la psicosmología mitopoética de los sueños como estados separados, sin embargo, interactúan de manera curiosa.					
				El umbral de la liminalidad es un espacio entre la vigilia y los sueños donde el pensamiento dirigido es imposible.			56	030.jpg	13A0A
				Busca un lugar cálido y permite que el sueño te envuelva para descubrir el umbral de la liminalidad.					
ARCHETYPE_LOSTKEYCLUE	The Archetype		AdventureUI/keyItem	¿Qué tal si te sientas junto al fuego en la choza y cruzas el umbral liminal para encontrar la llave perdida de Amileño?			55	031.jpg	23C1X
GIRL_LOSTKEYTHOUGHTS	Girl	AdventureUI/tweetIconGourd		Vaya, Amileño está fuera de sí por algo... Me pregunto qué pasará. Prefiero salir un momento y dejarlo solo.					
				He visto a La Escita cantar la Canción de Espadamancia y enviar tres Espíritus Silvanos al cielo. Me pregunto si ayudarán a disipar la tormenta.					
LOGFELLA_MORELOSTKEYTHOUGHTS	Logfella			Espero que La Escita pueda encontrar mi llave... la perdí en la orilla arenosa de un lago sereno.			62	032.jpg	U3A20
LOGFELLA_LOSTKEYTHOUGHTS	Logfella			Oh, vaya, preferiría que no estuviera lloviendo afuera... Preferiría que mis botas no estuvieran tan mojadas... Preferiría volver a cortar leña.					
				Rayos!, ¿dónde se ha ido mi llave? ¡Estoy tan molesto y avergonzado que ahora estoy totalmente desesperado!					
LOGFELLA_FOUNDKEY	The Scythian		AdventureUI/keyItem	El leñador estaba muy aliviado de que hayamos logrado recuperar su llave perdida del reino crepuscular de los sueños.					
				El leñador conocido como Amileño se preguntó cómo nos volvimos tan astutos y nos preguntó sobre nuestro funesto cometido.					
				Le contamos al leñador cómo crecimos en las estepas junto a nuestras valientes hermanas y hermanos escitas.					
				Le contamos a Amileño por qué vagábamos por esta montaña desierta y cómo éramos guiados por el dedo de un Dios omnisciente.					
			adventureUI/megatomeItem	Le contamos a Amileño sobre lo que sospechábamos que podrían significar los enigmáticos símbolos dentro de El Megatomo.					
			gourd/gourd	Teníamos la corazonada de que necesitábamos convocar a algunos Espíritus Silvanos más para disipar la tormenta.			104	033.jpg	W3D3G
			triangle/Triangle	En un susurro silencioso hablamos de nuestra intención de encontrar y domar una manifestación de geometría cósmica conocida como El Trigón Dorado.					
				Estaba muy claro que el leñador conocido como Amileño había dejado de prestar atención.					
			AdventureUI/keyItem	Nos dimos cuenta de que podríamos quedarnos con la llave y dar un paseo por el antiguo camino más allá del muro de piedra.					
LOGFELLA_FOUNDKEYWAKEUP	The Scythian		AdventureUI/keyItem	Le preguntamos al leñador si sería aceptable que tomáramos su llave y él estuvo de acuerdo.					
GIRL_FOUNDKEY	The Scythian			Nos encontramos con Samae empapada bajo la lluvia en un sendero lateral.					
			gourd/gourd	Ella había oído las sutiles y melodiosas brumas de los Espíritus Silvanos más allá del muro de piedra en el antiguo camino hacia Mingi Tau.					
			gourd/gourd	Ella habló de troncos de árboles altísimos a ambos lados de un poderoso río.					
			gourd/gourd	Ella habló de unos arcoíris tenues en el borde del Precipicio Peligroso.					
			adventureUI/megatomeItem	...Y luego se puso temerosa y nos dijo que consultáramos El Megatomo si nos sentíamos perdidos o confundidos.					
LOGFELLA_FOUNDKEYTHOUGHTS	Logfella			Estoy de acuerdo en que La Escita tome la llave si eso significa disipar la tormenta.					
				Debo haber asentido en algún momento durante la épica historia de La Escita. Tengo poca paciencia para el folclore.					
				Le pregunté a La Escita sobre su funesto cometido... empezó a hablar de las estepas y del dedo de Dios.					
GIRL_FOUNDKEYTHOUGHTS	Girl			Uno o dos Espíritus Silvanos más enviados al cielo disiparán la tormenta incesante... ¡Y luego comenzará la temporada de milagros! #miracles			129	034.jpg	33A44
GIRL_SUPERMOTHERTREE	Girl			En mis paseos en sueños hay una tranquilidad emocionante cuando la luna brilla más... y cuando la luna está oscura, los bosques se vuelven salvajes.					
				En los sueños, siempre son los mismos lugares y espacios, excepto cuando varían según el temperamento de la luna.					
				Todas las noches desde que se disipó la tormenta he tenido el mismo sueño en el que merodeo por el bosque en la hora antes del amanecer.					
ARCHETYPE_TREEHINT	The Archetype			Recuerda que la ingesta de hongos del bosque puede ofrecerte una visión oblicua de los fenómenos criptozoológicos y esas cosas.					
				Busca las melodiosas brumas de los Espíritus Silvanos e investiga sus alrededores.					
				Una vez que hayas comenzado la Canción de Espadamancia, puedes tocar el aura y deslizar para mirar alrededor.					
ARCHETYPE_MUSHROOMHINT	The Archetype			Incluso se ha afirmado que los hongos adivinatorios pueden haber desempeñado un papel importante en el desarrollo de la psique humana.					
				La evidencia arqueológica indica que el uso chamánico de los hongos para la comunión religiosa, la adivinación y la curación es bastante antiguo.					
				Fisiológicamente, es posible que experimentes sensaciones de bienestar y percepciones aumentadas, una disminución del estrés y una pérdida del apetito.					
				Los hongos del bosque podrían ofrecerte una visión oblicua sobre el paradero de un espíritu silvano y sus extraños activadores.			60	035.jpg	53A5Y
ARCHETYPE_TRIGONGROVE	The Archetype			¿Lo puedes sentir? ¿Estás comenzando a comprender? ¿Tienen los símbolos y formas esotéricas dentro de El Megatomo un nuevo significado?					
				Este rayo conecta el mundo de los vivos y el mundo de los muertos, por lo que es posible que encuentres uno o dos fantasmas con los que hablar en tus viajes.					
				Me han informado de que has activado el primer rayo ascendente en la Arboleda Trigonal.					
GIRL_CABINSHEEP	The Scythian			Preguntamos a Samae sobre las ovejas insignificantes que holgazaneaban por la choza y ella nos dijo que se habían asustado hace un rato.					
			gourd/gourd	Le informamos a Samae que enviamos cinco Espíritus Silvanos al cielo y ella nos dijo que tal vez la temporada de milagros estaba por llegar.					
				Pensamos que tal vez deberíamos ir a investigar el prado donde solían holgazanear las ovejas.					
LOGFELLA_CABINSHEEP	The Scythian			Amileño tenía la sensación de que había llegado la temporada de milagros y se preguntó si, tal vez, estaba a punto de suceder algo impresionante.			79	036.jpg	V3G62
GIRL_CABINSHEEPTHOUGHTS	Girl			Pero qué... ¡La lluvia ha cesado! ¿Está comenzando a disiparse la tormenta? Eso espero.					
				Toda esta tormenta me ha estado afectando mucho. ¡Ha sido todo tan sombrío!					
LOGFELLA_CABINSHEEPTHOUGHTS	Logfella			Hmm... Se me puso la piel de gallina... Sin duda algo está pasando... ¿Está comenzando a disiparse la tormenta?					
				Cada vez que necesito recobrar fuerzas, me siento junto al fuego para calentarme las botas.					
DOGFELLA_CABINSHEEPTHOUGHTS	Dogfella			Guau Guau Guau Guau Guau Guau Guau Guau. #stillbarking #miracles			84	037.jpg	V3C7I
ARCHETYPE_MEADOWHINT	The Archetype			Una vez que el sol esté alineado, se te concederán las habilidades milagrosas de plegado del gran mago Al Jaffee.					
				¿Sientes esa sensación peculiar? ¡Es la temporada de milagros! Entona la Canción de Espadamancia y mira hacia los pájaros enojados que se alzan imponentes.			76	038.jpg	A3G84
ARCHETYPE_MEADOWHINTTWO	The Archetype			Mira al cielo en busca de una visión oblicua sobre el funcionamiento de este milagro del prado y admira a El Trigón Dorado.					
ARCHETYPE_SIDE_B	The Archetype	AdventureUI/tweetIconInfo		Hmm... interesante la forma con que has manejado el encuentro con el caníbal cabeza de oso.			120	039.jpg	O3G9D
				No, no te preocupes, está bien, es solo interesante. Nunca había visto a nadie hacer lo que hiciste. Es excepcional, pero no te alarmes.					
				Bueno, sigamos. Aún te quedan muchas cosas por disfrutar en tu experiencia con S:S&S EP, particularmente en la Cara B.					
ARCHETYPE_GOLDTRIGONHINTONE	The Archetype			Para domar a El Trigón Dorado debes aprender a sobrevivir a los tres movimientos de su extraña canción usando una mezcla de ataque y defensa.					
				Es absolutamente fundamental que mantengas pulsado el botón de escudo siempre que puedas para recobrar tu fuerza perdida.					
				Veo que ya has invocado e intentado domar a El Trigón Dorado. Tengo algunas cosas que comentarte que creo te serán de útilidad.					
ARCHETYPE_GOLDTRIGONHINTTWO	The Archetype			Repele los ataques de proyectiles triangulares con tu espada y espera al momento justo para esquivar los ataques cargados.			83	040.jpg	3.4E+02
				La lógica inescrutable e insondable de El Trigón Dorado ha reclamado las almas de todos aquellos que te precedieron... ellos carecían de tenacidad y coraje.					
ARCHETYPE_GOLDTRIGONHINTTHREE	The Archetype			El Trigón Dorado debe ser domado, no hay otra opción.					
				En el tercer patrón debes repeler los pequeños proyectiles triangulares con tu espada y esquivar los ataques cargados.					
				En el segundo patrón debes esperar al ataque cargado y presionar el botón de escudo en el momento adecuado para esquivarlo.					
				En el primer patrón debes blandir tu espada para devolver la bola de energía.					
ARCHETYPE_BRIGHTTRIGONHINTONE	The Archetype			Es posible que hayas notado que El Trigón Luna Radiante reparte muerte desde arriba... así que espera al momento justo y usa tu escudo para esquivar.			144	041.jpg	8.4E+12
ARCHETYPE_BRIGHTTRIGONHINTTWO	The Archetype			El patrón final de El Trigón Luna Radiante requerirá que blandas tu espada contra los proyectiles y esquives los ataques cargados.					
ARCHETYPE_DARKTRIGONHINTONE	The Archetype			Es posible que ya te hayas encontrado con el ataque de arcoíris de El Trigón Luna Sombría. Rebana ese arcoíris tan rápido como puedas.					
ARCHETYPE_DARKTRIGONHINTTWO	The Archetype			El patrón final de El Trigón Luna Sombría implica sutiles proyectiles triangulares. Destrúyelos y sobrevivirás.					
ARCHETYPE_MEGATOMEOUTRO	The Archetype	AdventureUI/tweetIconBabelBook		Así que has despertado al espectro inmortal que aletargaba en la oscuridad debajo de Mingi Tau... ¡Uff!					
				En consecuencia, se vislumbra una siniestra tormenta y la gente encantadora que vive en la choza de piedra se siente desolada.					
			adventureUI/megatomeItem	El resultado es que tienes un pesado libro conocido como El Megatomo. En nuestra próxima sesión hablaremos de su extraño propósito.					
				Nuestra investigación ha demostrado que la exposición prolongada a la psicosmología mitopoética de S:S&S EP puede tener efectos adversos.					
				Así que ahora que has completado la Sesión I, ¿Qué te parece si nos tomamos un pequeño descanso? Estaré justo aquí cuando quieras comenzar con la Sesión II.					
ARCHETYPE_GOLDMASTERINTRO	The Archetype	AdventureUI/tweetIconBabelBook							
				Me alegra verte de nuevo. ¿Estás listo para comenzar con la Sesión II de S:S&S EP?					
			adventureUI/megatomeItem	Bien, ¿Dónde nos quedamos? Ah, cierto, ahora recuerdo. Conseguiste un pesado libro conocido como El Megatomo.					
				Despertaste a un espectro inmortal que aún acecha en la oscuridad debajo de Mingi Tau. Que espeluznante, ¿verdad?			204	042.jpg	24B2J
				Son tiempos de angustia, una siniestra tormenta ha nublado el cielo y la gente encantadora que vive en la choza es desdichada.					
				Disipar la tormenta requerirá cierta familiaridad con la psiónica, la criptozoología y los milagros...					
			adventureUI/megatomeItem	1. El toque de un espadamante liberará El Megatomo, revelando los pensamientos no expresados de criaturas vivas y otro material esotérico.					
			gourd/gourd	2. Extraños Espíritus Silvanos, fuentes de Espadamancia, duermen en estanques, bosques y prados. Busca sus sutiles y melodiosas brumas.					
			triangle/Triangle	3. El espadamante que pueda localizar, convocar y domar la geometría cósmica de El Trigón Dorado poseerá la habilidad de obrar milagros.					
				¿Confundido? Excelente. Mantén la calma y sigue adelante.			210	043.jpg	A4C31
ARCHETYPE_GOLDMASTEROUTRO	The Archetype		triangle/Triangle	¡Bravo! Has localizado y sometido la geometría cósmica de El Trigón Dorado.			86	044.jpg	24E4H
				Milagrosamente, la siniestra tormenta se ha disipado y el glorioso sol ha regresado al reino, ¡eso es realmente increíble!					
				Tus heroicas hazañas reflejan bien tu percepción, intuición y perseverancia, ¡Lo has hecho muy bien hasta ahora!					
				Nota: Si decides continuar con el experimento S:S&S EP, esas cualidades mencionadas anteriormente serán desafiadas y evaluadas.					
				En cualquier caso, tomemos otro pequeño descanso, ¿De acuerdo? Como siempre, estaré aquí cuando estés listo para comenzar con la Sesión III.					
ARCHETYPE_TRIFECTAINTRO	The Archetype								
				Comencemos con la Sesión III. Nota: Esta sesión generalmente requiere un mes lunar para completarse.					
			triangle/Triangle	¿Así que has domado El Trigón Dorado y la tormenta se ha disipado milagrosamente? ¡Bravo por eso!					
			adventureUI/megatomeItem	Consulta El Megatomo y estudia su funcionamiento si te llegas a sentir perdido o confundido.					
				Un espectro inmortal aún acecha en la oscuridad debajo de Mingi Tau.					
			Archetype/trifecta	Considera la geometría cósmica de La Tríada Trigonal.					
			MoonCrescent/moonCrescent	Observa el temperamento de la luna.			118	045.jpg	Y4E5Q
				Nuestra investigación ha demostrado que aquellos pocos que persisten a través de la locura oblicua que sigue pueden convertirse en amigos cósmicos para siempre.					
				Se advierte que de aquí en adelante estaremos monitoreando tus acciones en relativo silencio.					
ARCHETYPE_TRIFECTAOUTRO	The Archetype		Archetype/trifecta	¿Así que domaste los dos Trigones restantes y reconstruiste La Tríada Trigonal?			165	046.jpg	P4B6A
			Archetype/trifecta	Eres especial y es exactamente por eso que me agradas tanto.					
				Fue muy valiente y generoso ofrecer como mártir a La Escita en la cima de Mingi Tau.					
				En serio, te debemos una.					
				Todo lo que queda es arrastrar a La Escita hasta la cima y presenciar el Arremolinado Infinito.					
				¡Ten valor, el final está cerca!					
ARCHETYPE_GHOULINTRO	The Archetype								
				Bueno, aquí estamos. Esta breve sesión marcará el fin del tratamiento de S:S&S EP.					
				El funesto cometido de La Escita está casi completo.					
				Lamentablemente, el cuerpo y la psique de La Escita han sido significativamente debilitados por la Espadamancia; ella está al borde de la muerte.			162	047.jpg	J4F7B
			Archetype/trifecta	Todo lo que resta es desvelar los secretos de la Arboleda Trigonal y subir El Megatomo al Arremolinado Infinito en la cima de Mingi Tau.					
				Presiona 'jugar' solo si estás listo para presenciar el terrible tormento del martirio.					
END	The Scythian			En la cima de Mingi Tau, subimos El Megatomo a la seguridad eterna del Arremolinado Infinito.					
END_CHEAT	The Scythian			En la cima de Mingi Tau, subimos El Megatomo a la seguridad eterna del Arremolinado Infinito. #cheat					
END_CHEAT_NOBOOR	The Scythian			En la cima de Mingi Tau, subimos El Megatomo a la seguridad eterna del Arremolinado Infinito. #cheat #noboor					
END_CHEAT_PSYCHO	The Scythian			En la cima de Mingi Tau, subimos El Megatomo a la seguridad eterna del Arremolinado Infinito. #cheat #psycho					
END_CHEAT_LOVE	The Scythian			En la cima de Mingi Tau, subimos El Megatomo a la seguridad eterna del Arremolinado Infinito. #cheat #love			202	048.jpg	D4A81
END_MOONGROTTO_PSYCHO	The Scythian			En la cima de Mingi Tau, subimos El Megatomo a la seguridad eterna del Arremolinado Infinito. #moongrotto #psycho			180	049.jpg	74D9P
END_MOONGROTTO_LOVE	The Scythian			En la cima de Mingi Tau, subimos El Megatomo a la seguridad eterna del Arremolinado Infinito. #moongrotto #love			176	050.jpg	Y5F0P
END_HONEST_PSYCHO	The Scythian			En la cima de Mingi Tau, subimos El Megatomo a la seguridad eterna del Arremolinado Infinito. #honest #psycho			179	051.jpg	M5C1H
END_HONEST_LOVE	The Scythian			En la cima de Mingi Tau, subimos El Megatomo a la seguridad eterna del Arremolinado Infinito. #honest #love			177	052.jpg	55E2B
END_HONEST_NOBOOR	The Scythian			En la cima de Mingi Tau, subimos El Megatomo a la seguridad eterna del Arremolinado Infinito. #honest #noboor			178	053.jpg	75G3V
GIRL_GHOULTHOUGHTS	Girl			¿Sabe La Escita que es posible detener a La Masa Gogolítica tocando su cráneo con Espadamancia? Probablemente no.					
				Espero que La Escita sepa que debe mantener pulsado el sendero hacia adelante para avanzar rápidamente, si no lo hace, estará en problemas.					
				¿Dónde estoy? ¿Qué pasó? Lo último que recuerdo es que estaba caminando en sueños por el bosque cuando vi una inquietante luz rosada.					
LOGFELLA_GHOULTHOUGHTS	Logfella			La Escita sigue hablando sobre su funesto cometido de abrir una entrada al Arremolinado Infinito en la cima de Mingi Tau.					
				Todo ha estado completamente loco desde que apareció La Escita muchas lunas atrás.					
LOGFELLA_GHOUL	The Scythian			Nos despertamos aturdidos de un sueño muy profundo cerca de la Arboleda Trigonal con el leñador conocido como Amileño a nuestro lado.			88	054.jpg	J5D44
				Amileño habló sobre cómo Samae había desaparecido la noche anterior.					
				El leñador sabía que estábamos cerca del final y que debíamos volver a Mingi Tau para finalizar nuestro funesto cometido.					
LOGFELLA_TRIGONGROVETIPS	The Scythian			El leñador conocido como Amileño nunca antes había visto la Arboleda Trigonal y se preguntaba de qué se trataba todo aquello.					
LOGFELLA_TRIFECTATIPS	The Scythian			El leñador conocido como Amileño se sentía muy triste por la ausencia de Samae.					
				Le dijimos a Amileño que sabíamos dónde podría estar ella y pronto arreglaríamos las cosas.					
				Él miró la plataforma cercana y nos agradeció de antemano por todo lo relacionado con el martirio.					
URSULA_AVATAR			Ursula/idleSEhandsonhip						
DOG_AVATAR			AdventureUI/dudeDogfellaIdle1						
AMPHITHEATRE_LEFT	The Scythian	AdventureUI/tweetIconInfo		Estos dos tipos afirmaban ser parte de los creadores de este mundo estrafalario.			159	055.jpg	A5G55
AMPHITHEATRE_RIGHT	The Scythian	AdventureUI/tweetIconInfo		Los dos chiflados afirmaban ser parte de los creadores de este mundo estrafalario.			159	055.jpg	A5G55
GOURD_MOUNTAINMEADOW	The Scythian	AdventureUI/tweetIconGourd	gourd/gourd	Despertamos a un espíritu silvano en la tierra fértil de un prado habitado por cuatro pares de ovejas insignificantes.			52	056.jpg	15B63
GOURD_CABIN	The Scythian	AdventureUI/tweetIconGourd	gourd/gourd	Cantamos la Canción de Espadamancia y despertamos a un espíritu silvano de las frescas aguas de un estanque profundo, ¡Qué raro!			50	057.jpg	G5F78
GOURD_UPSLOPEWOODSONE	The Scythian	AdventureUI/tweetIconGourd	gourd/gourd	Despertamos a un espíritu silvano en un curioso nido rodeado de tres pájaros cantores empapados por la lluvia.					
GOURD_UPSLOPEWOODSTWO	The Scythian	AdventureUI/tweetIconGourd	gourd/gourd	Despertamos a un espíritu silvano junto a un sólido puente de troncos donde cuatro pares de árboles se elevan sobre un río.					
GOURD_UPSLOPEWOODSFOUR	The Scythian	AdventureUI/tweetIconGourd	gourd/gourd	Despertamos a un espíritu silvano entre dos arcoíris repugnantes al lado del Precipicio Peligroso.					
GOURD_WATERFALLS	The Scythian	AdventureUI/tweetIconGourd	gourd/gourd	La Luna Sombría reina y despertamos a un espíritu silvano rodeado por cinco cascadas.					
GOURD_MOUNTAINTOP	The Scythian	AdventureUI/tweetIconGourd	gourd/gourd	La Luna Sombría reina y despertamos a un espíritu silvano en la maleza en lo alto de un peñasco rocoso.					
GOURD_SECRET2_STONESHELTER	The Scythian	AdventureUI/tweetIconGourd	gourd/gourd	La Luna Radiante se cierne y despertamos a un espíritu silvano en un claro oculto donde casualmente se encontraba Jim Guthrie.			132	058.jpg	G5F8U
GOURD_MOUNTAINLAKESHORE	The Scythian	AdventureUI/tweetIconGourd	gourd/gourd	La Luna Radiante se cierne y despertamos a un espíritu silvano en las aguas traquilas de un lago donde una pata madre estaba enloqueciendo.					
GOURD_LAKESHOREBUNNYSTRAIGHTAWAY	The Scythian	AdventureUI/tweetIconGourd	gourd/gourd	La Luna Radiante se cierne y despertamos a un espíritu silvano donde el reflejo del lago era ligeramente incongruente.			127	059.jpg	65D98
GOURD_LAKESHORELAKE	The Scythian	AdventureUI/tweetIconGourd	gourd/gourd	La Luna Radiante se cierne y despertamos a un espíritu silvano en un lago sereno bajo una tríada de búhos.					
GOURD_PINKCOLLECTED	The Scythian	AdventureUI/tweetIconGourd	Archetype/trifecta	Tenemos esa sensación peculiar de que, tal vez, estemos ante la temporada de milagros. #miracles					
GOURD_MOUNTAINSIDE	The Scythian	AdventureUI/tweetIconGourd	gourd/gourd	La Luna Sombría reina y despertamos a un espíritu silvano rodeado por tres pequeñas cascadas.					
GOURD_SECRET1_FOOTOFMOUNTAIN	The Scythian	AdventureUI/tweetIconGourd	gourd/gourd	La Luna Sombría reina y despertamos a un espíritu silvano rodeado de cuatro pequeños árboles redondos en los bosques más oscuros.					
GOURD_BRISKLYWALKING	The Scythian	AdventureUI/tweetIconGourd	gourd/gourd	La Luna Sombría reina y despertamos a un espíritu silvano en la maleza al otro lado de un lago.					
GOURD_HUGETREE	The Scythian	AdventureUI/tweetIconGourd	gourd/gourd	La Luna Radiante se cierne y despertamos a un espíritu silvano acechando en la raíz de un árbol titánico.					
GOURD_BLUECOLLECTED	The Scythian	AdventureUI/tweetIconGourd	Archetype/trifecta	Tenemos esa sensación peculiar de que, tal vez, estemos ante la temporada de milagros. ¿Dónde están mis milagros? #miracles			77	060.jpg	86D06
GCLUE_MOUNTAINMEADOW	Dogfella	AdventureUI/tweetIconGourd		Guau Guau Guau Guau Guau Guau. #barking			135	061.jpg	M6F1I
				Guau Guau Guau. #justbarking					
				A veces me canso de ladrar todo el tiempo, pero un perro tiene que hacer lo que se supone que un perro tiene que hacer.					
				Guau Snif Guau. #mixingitup					
				Guau Guau Guau Guau Guau Guau.					
GCLUE_UPSLOPEWOODSONE	Girl	AdventureUI/tweetIconGourd		Hay algo extraño en cómo se comportó La Escita, casi como si estuviera siendo controlada por una fuerza invisible.					
				Me gustaría saber más sobre la historia épica de La Escita, apuesto a que entonces todo tendría sentido.					
GCLUE_UPSLOPEWOODSTWO	Logfella	AdventureUI/tweetIconGourd		Espero que La Escita esté invirtiendo todos sus esfuerzos en el tema de los Espíritus Silvanos.					
				La tormenta realmente me ha afectado, me hace desear que los videojuegos existieran en... en el momento en que se supone que estamos.					
GCLUE_UPSLOPEWOODSFOUR	Girl	AdventureUI/tweetIconGourd		Todo ha estado completamente loco desde que apareció La Escita.			3	062.jpg	36E2Z
GCLUE_YELLOWCOLLECTED	Girl	AdventureUI/tweetIconGourd		Toda esta tormenta me ha estado afectando mucho. ¡Ha sido todo taaan sombrío!					
				La lluvia ha comenzado a ceder y el cielo parece aclararse... ¿Será está la temporada de milagros? Espero que así sea, no hay duda que los amo.					
				Vaya... ¿Qué? Las ovejas del prado se han asustado... Me pregunto qué estará pasando, podría ser... ¿El Trigón Dorado?					
GCLUE_MOUNTAINTOP	Dogfella	AdventureUI/tweetIconGourd		Guau Guau Guau. 					
				A veces cuando las cosas están demasiado oscuras para mi, ingiero algo y veo incluso lo que no está ahí.					
				Guau Guau Guau Guau Guau.					
GCLUE_SECRET2_STONESHELTER	Logfella	AdventureUI/tweetIconGourd		Tengo esta canción en mi cabeza... una canción alegre y triste que me llena de un extraño y hermoso temor.					
