id	user	icon	portrait	English	Japanese	Final Notes	pic	Filenames	Codes
LOGFELLA_LOSTKEY	The Scythian			El leñador afligido conocido como Tronquero estaba hecho un manojo de nervios por algo.					
			AdventureUI/keyItem	Al parecer, había perdido la llave de la puerta trancada en el muro de piedra que bloqueaba el antiguo camino hacia Mingi Tau.					
				Y pensamos, con un suspiro: '¿Otra misión de búsqueda? ¿O qué?'.					
				Nos dijo que estaba sentado justo aquí cuando cayó en un sueño profundo.					
			AdventureUI/keyItem	Tronquero nos dijo que creía haber perdido su llave en el reino crepuscular de los sueños.					
				Ya habíamos oído hablar de los extraños sueños de los montañeses de cabello oscuro del Cáucaso, por lo que esto tenía total sentido para nosotros.					
				Tronquero nos invitó a calentar nuestras botas junto al fuego para soñar con él.			63	029.jpg	U2C92
ARCHETYPE_LOSTKEYTHOUGHTS	The Archetype			Pensamos en la vigilia y la psicosmología mitopoética de los sueños como estados separados, pero interactúan de manera curiosa.					
				El umbral de la liminalidad es un espacio entre la vigilia y los sueños donde el pensamiento dirigido es imposible.			56	030.jpg	13A0A
				Busca un lugar cálido y permite que el sueño te envuelva para descubrir el umbral de la liminalidad.					
ARCHETYPE_LOSTKEYCLUE	The Archetype		AdventureUI/keyItem	¿Qué tal si te sientas junto al fuego en la choza y cruzas el umbral de la liminalidad para encontrar la llave perdida de Tronquero?			55	031.jpg	23C1X
GIRL_LOSTKEYTHOUGHTS	Girl	AdventureUI/tweetIconGourd		Vaya, Tronquero está hecho un manojo de nervios... ¿Qué le pasa? Mejor salgo un rato y lo dejo tranquilo.					
				Vi a La Escita entonar la Canción de Espadancia y enviar tres espíritus silvanos al cielo. Me pregunto si ayudarán a disipar la tormenta.					
LOGFELLA_MORELOSTKEYTHOUGHTS	Logfella			Espero que La Escita pueda encontrar mi llave... la perdí en la orilla arenosa de un lago apacible.			62	032.jpg	U3A20
LOGFELLA_LOSTKEYTHOUGHTS	Logfella			Ah, rayos, cómo odio esta lluvia... Cómo odio tener las botas mojadas... Cómo quisiera volver a cortar leña.					
				¡Rayos! ¿Dónde se ha ido mi llave? ¡Estoy tan molesto y avergonzado que no puedo calmarme!					
LOGFELLA_FOUNDKEY	The Scythian		AdventureUI/keyItem	Tronquero se mostró sinceramente aliviado de que hubiéramos recuperado su llave perdida del reino crepuscular de los sueños.					
				El leñador quiso saber cómo nos volvimos tan listos y nos preguntó por nuestro funesto cometido.					
				Le contamos cómo crecimos en las estepas junto a nuestras valientes hermanas y hermanos escitas.					
				Le explicamos a Tronquero por qué vagábamos por esta montaña desierta y cómo nos guiaba el dedo de un Dios omnisciente.					
			adventureUI/megatomeItem	Le compartimos lo que sospechábamos que significaban los enigmáticos símbolos del Megatomo.					
			gourd/gourd	Intuíamos que aún debíamos despertar a algunos espíritus silvanos más para disipar la tormenta.			104	033.jpg	W3D3G
			triangle/Triangle	En un susurro revelamos nuestra intención de hallar y domar la geometría cósmica conocida como el Trigón Dorado.					
				Para entonces era evidente que Tronquero había dejado de escucharnos.					
			AdventureUI/keyItem	Decidimos quedarnos con la llave y seguir por el antiguo camino, más allá del muro de piedra.					
LOGFELLA_FOUNDKEYWAKEUP	The Scythian		AdventureUI/keyItem	Le preguntamos al leñador si podíamos quedarnos con su llave y él aceptó.					
GIRL_FOUNDKEY	The Scythian			En un sendero lateral encontramos a Samae, empapada por la lluvia.					
			gourd/gourd	Había oído las sutiles y melodiosas brumas de los espíritus silvanos más allá del muro de piedra, en el antiguo camino hacia Mingi Tau.					
			gourd/gourd	Nos habló de árboles colosales que flanqueaban un impetuoso río.					
			gourd/gourd	Mencionó arcoíris tenues que se formaban a la vera del Precipicio Peligroso.					
			adventureUI/megatomeItem	...y luego, inquieta, nos pidió consultar el Megatomo si llegábamos a sentirnos perdidos.					
LOGFELLA_FOUNDKEYTHOUGHTS	Logfella			Me parece bien que La Escita se quede con la llave si va a disipar la tormenta.					
				Debo haberme quedado dormido en algún momento durante la épica historia de La Escita. No me van mucho las historias.					
				Le pregunté a La Escita sobre su funesto cometido... empezó a hablar de las estepas y del dedo de Dios.					
GIRL_FOUNDKEYTHOUGHTS	Girl			Uno o dos espíritus silvanos más enviados al cielo disiparán la tormenta incesante... ¡Y luego comenzará la temporada de milagros! #miracles			129	034.jpg	33A44
GIRL_SUPERMOTHERTREE	Girl			En mis paseos, hay una calma emocionante cuando la luna brilla más... y cuando la luna está oscura, los bosques se vuelven salvajes.					
				En los sueños, siempre son los mismos lugares y espacios, excepto cuando varían según el humor de la luna.					
				Todas las noches desde que se disipó la tormenta, he tenido el mismo sueño en el que paseo por el bosque en la hora antes del amanecer.					
ARCHETYPE_TREEHINT	The Archetype			Recuerda que ingerir hongos del bosque puede brindarte cierta perspectiva oblicua sobre fenómenos criptozoológicos y cosas así.					
				Busca las melodiosas brumas de los espíritus silvanos e investiga su entorno.					
				Una vez que hayas comenzado la Canción de Espadancia, puedes tocar el aura y deslizar para mirar a tu alrededor.					
ARCHETYPE_TREEHINT_NINSWITCH	The Archetype			Recuerda que ingerir hongos del bosque puede brindarte cierta perspectiva oblicua sobre fenómenos criptozoológicos y cosas así.					
				Busca las melodiosas brumas de los espíritus silvanos e investiga su entorno.					
				Una vez que hayas comenzado la Canción de Espadancia, puedes tocar el aura y deslizar para mirar a tu alrededor.					
ARCHETYPE_MUSHROOMHINT	The Archetype			Incluso se ha afirmado que los hongos adivinatorios pudieron tener un papel importante en el desarrollo de la psique humana.					
				La evidencia arqueológica indica que el uso chamánico de los hongos para la comunión religiosa, la adivinación y la curación es bastante antiguo.					
				Fisiológicamente, es posible que experimentes sensaciones de bienestar y percepciones aumentadas, una disminución del estrés y una pérdida del apetito.					
				Los hongos del bosque podrían ofrecerte una visión oblicua sobre el paradero de un espíritu silvano y sus extraños activadores.			60	035.jpg	53A5Y
ARCHETYPE_TRIGONGROVE	The Archetype			¿Lo sientes? ¿Empiezas a comprender? ¿Cobran ahora un nuevo significado los símbolos esotéricos del Megatomo?					
				Este haz conecta el mundo de los vivos y los muertos, así que quizá conozcas a algún fantasma con quien hablar en tus viajes.					
				Acabo de enterarme de que activaste el primer haz celestial en el Claro Trigonal.					
GIRL_CABINSHEEP	The Scythian			Preguntamos a Samae sobre las ovejas inútiles que holgazaneaban por la choza y ella nos dijo que se habían asustado hace un rato.					
			gourd/gourd	Le contamos a Samae que habíamos enviado cinco espíritus silvanos al cielo y ella nos dijo que tal vez la temporada de milagros estaba por llegar.					
				Pensamos que tal vez deberíamos ir a investigar el prado donde solían holgazanear las ovejas.					
LOGFELLA_CABINSHEEP	The Scythian			Tronquero sentía que había llegado la temporada de milagros y se preguntaba si estaba por ocurrir algo increíble.			79	036.jpg	V3G62
GIRL_CABINSHEEPTHOUGHTS	Girl			¡Dejó de llover! ¿Se estará disipando la tormenta? Espero que sí.					
				Esta tormenta me tiene muy cansada. ¡Todo ha estado tan lúgubre!					
LOGFELLA_CABINSHEEPTHOUGHTS	Logfella			Hmm... Siento un escalofrío... Sin duda algo está pasando... ¿Está comenzando a disiparse la tormenta?					
				Cada vez que necesito recobrar fuerzas, me siento junto al fuego para calentarme las botas.					
DOGFELLA_CABINSHEEPTHOUGHTS	Dogfella			Guau Guau Guau Guau Guau Guau Guau Guau. #stillbarking #miracles			84	037.jpg	V3C7I
ARCHETYPE_MEADOWHINT	The Archetype			Una vez que el sol esté alineado, recibirás el don de plegar la realidad del gran mago 'Al Jaffee'.					
				¿Sientes esa sensación peculiar? ¡Es temporada de milagros! Entona la Canción de Espadancia y mira hacia los imponentes 'Angry Birds'.			76	038.jpg	A3G84
ARCHETYPE_MEADOWHINTTWO	The Archetype			Mira al cielo en busca de una visión oblicua sobre el funcionamiento de este milagro del prado y admira el Trigón Dorado.					
ARCHETYPE_SIDE_B	The Archetype	AdventureUI/tweetIconInfo		Hmm... interesante cómo manejaste ese encuentro con el caníbal cabeza de oso.			120	039.jpg	O3G9D
				No, no te preocupes, está bien, es solo interesante. Nunca vi a nadie hacer lo que hiciste. Es excepcional, pero no te alarmes.					
				Bueno, sigamos. Aún te quedan muchas cosas por disfrutar en tu experiencia con S:S&S EP, particularmente en la Cara B.					
ARCHETYPE_GOLDTRIGONHINTONE	The Archetype			Para domar el Trigón Dorado debes sobrevivir a los tres movimientos de su extraña canción usando una mezcla de ataque y defensa.					
				Es crucial que mantengas pulsado el botón del escudo cuando puedas para recobrar tu fuerza perdida.					
				Veo que has invocado e intentado domar el Trigón Dorado. Tengo algunas cosas que comentarte que creo te serán útiles.					
ARCHETYPE_GOLDTRIGONHINTTWO	The Archetype			Golpea los ataques de proyectiles psiónicos del Trigón con tu espada y espera la oportunidad para esquivar sus ataques cargados.			83	040.jpg	34E01
				La lógica inescrutable del Trigón Dorado ha reclamado las almas de quienes te precedieron... ellos carecían de tenacidad y coraje.					
ARCHETYPE_GOLDTRIGONHINTTHREE	The Archetype			El Trigón Dorado debe ser domado, no hay otra opción.					
				En el tercer patrón, debes golpear los pequeños proyectiles triangulares con tu espada y esquivar los ataques cargados.					
				En el segundo patrón, debes esperar su ataque cargado y pulsar el botón de escudo en el momento adecuado para esquivarlo.					
				En el primer patrón, debes blandir tu espada para devolver la bola de energía.					
ARCHETYPE_BRIGHTTRIGONHINTONE	The Archetype			Quizá notaste que el Trigón Luna Radiante llueve muerte... espera el momento justo y pulsa el escudo para esquivar.			144	041.jpg	84E11
ARCHETYPE_BRIGHTTRIGONHINTTWO	The Archetype			El patrón final del Trigón Luna Radiante requerirá que golpees los proyectiles con tu espada y esquives sus ataques de rayo cargados.					
ARCHETYPE_DARKTRIGONHINTONE	The Archetype			Quizá ya te hayas enfrentado al odioso ataque de arcoíris del Trigón Luna Sombría. Rebana ese arcoíris tan fuerte y rápido como puedas.					
ARCHETYPE_DARKTRIGONHINTTWO	The Archetype			El patrón final del Trigón Luna Sombría implica sutiles proyectiles triangulares. Destrúyelos y sobrevivirás.					
ARCHETYPE_MEGATOMEOUTRO	The Archetype	AdventureUI/tweetIconBabelBook		Así que despertaste al espectro inmortal que acechaba en la oscuridad bajo Mingi Tau... ¡Uf!					
				En consecuencia, se vislumbra una siniestra tormenta y la gente encantadora que vive en la choza de piedra se siente desolada.					
			adventureUI/megatomeItem	El resultado es que tienes un pesado libro conocido como el Megatomo. En nuestra próxima sesión hablaremos de su extraño propósito.					
				Nuestra investigación muestra que la exposición prolongada a la psicosmología mitopoética de S:S&S EP puede causar efectos adversos.					
				Así que ahora que completaste la Sesión I, ¿qué tal si descansamos un poco? Estaré justo aquí cuando quieras comenzar la Sesión II.					
ARCHETYPE_GOLDMASTERINTRO	The Archetype	AdventureUI/tweetIconBabelBook							
				Me alegra verte de nuevo. ¿Comenzamos con la Sesión II de S:S&S EP?					
			adventureUI/megatomeItem	Bien, ¿en qué estábamos? Ah, sí, ya me acuerdo. Conseguiste un pesado libro conocido como el Megatomo.					
				Despertaste a un espectro inmortal que aún acecha en la oscuridad bajo Mingi Tau. Qué personaje, ¿no?			204	042.jpg	24B2J
				Son tiempos de angustia: una siniestra tormenta ha nublado el cielo y la gente encantadora que vive en la choza está desolada.					
				Disipar la tormenta requerirá cierta familiaridad con la psiónica, la criptozoología y los milagros...					
			adventureUI/megatomeItem	1. El toque de un espadancista liberará el Megatomo, revelando los pensamientos no expresados de criaturas vivas y otro material esotérico.					
			gourd/gourd	2. Extraños espíritus silvanos, fuentes de Espadancia, duermen en estanques, bosques y prados. Busca sus sutiles y melodiosas brumas.					
			triangle/Triangle	3. El espadancista que pueda localizar, convocar y domar la geometría cósmica del Trigón Dorado poseerá la habilidad de obrar milagros.					
				¿Sientes confusión? Calma, calma, ¡Que no panda el cúnico!			210	043.jpg	A4C31
ARCHETYPE_GOLDMASTEROUTRO	The Archetype		triangle/Triangle	¡Bravo! Has localizado y sometido la geometría cósmica del Trigón Dorado.			86	044.jpg	24E4H
				Milagrosamente, la siniestra tormenta se ha disipado y el glorioso sol ha regresado al reino, ¡eso es realmente increíble!					
				Tus heroicas hazañas reflejan bien tu percepción, intuición y perseverancia. ¡Lo has hecho muy bien hasta ahora!					
				Nota: Si decides continuar con el experimento S:S&S EP, esas cualidades mencionadas anteriormente serán desafiadas y evaluadas.					
				En fin, tomemos otro pequeño descanso, ¿sí? Como siempre, estaré aquí cuando quieras comenzar con la Sesión III.					
ARCHETYPE_TRIFECTAINTRO	The Archetype								
				Comencemos con la Sesión III. Nota: Esta sesión generalmente requiere un mes lunar para completarse.					
			triangle/Triangle	¿Así que domaste el Trigón Dorado y la tormenta se disipó milagrosamente? ¡Bravo!					
			adventureUI/megatomeItem	Consulta el Megatomo y estudia su funcionamiento si te pierdes o sientes confusión.					
				Un espectro inmortal aún acecha en la oscuridad bajo Mingi Tau.					
			Archetype/trifecta	Considera la geometría cósmica de la Trífida Trigonal.					
			MoonCrescent/moonCrescent	Observa el humor de la luna.			118	045.jpg	Y4E5Q
				Nuestra investigación demuestra que los pocos que persisten en medio de la locura oblicua subsiguiente pueden volverse amigos cósmicos para siempre.					
				Se advierte que de aquí en adelante estaremos monitoreando tus acciones en relativo silencio.					
ARCHETYPE_TRIFECTAOUTRO	The Archetype		Archetype/trifecta	Entonces, ¿domaste los dos trigones restantes y reconstruiste la Trífida Trigonal?			165	046.jpg	P4B6A
			Archetype/trifecta	Eres especial y por eso mismo te quiero tanto.					
				Fue un acto de gran valentía y generosidad ofrecer como mártir a La Escita en la cima de Mingi Tau.					
				En serio, estamos en deuda contigo.					
				Solo queda arrastrar a La Escita a la cima y contemplar el Arremolinado Infinito.					
				¡Ten valor, el final está cerca!					
ARCHETYPE_GHOULINTRO	The Archetype								
				Bueno, aquí estamos. Esta breve sesión marcará el fin del tratamiento de S:S&S EP.					
				El funesto cometido de La Escita está casi cumplido.					
				Por desgracia, La Escita ha visto su cuerpo y psique gravemente debilitados por la Espadancia; ella está al borde de la muerte.			162	047.jpg	J4F7B
			Archetype/trifecta	Todo lo que resta es desvelar los secretos del Claro Trigonal y subir el Megatomo al Arremolinado Infinito en la cima de Mingi Tau.					
				Presiona 'jugar' solo si tienes el valor de presenciar el terrible tormento del martirio.					
END	The Scythian			En la cima de Mingi Tau, detonamos el Megatomo y lo precipitamos al Arremolinado Infinito.					
END_CHEAT	The Scythian			En la cima de Mingi Tau, subimos el Megatomo a la seguridad eterna del Arremolinado Infinito. #cheat					
END_CHEAT_NOBOOR	The Scythian			En la cima de Mingi Tau, subimos el Megatomo a la seguridad eterna del Arremolinado Infinito. #cheat #noboor					
END_CHEAT_PSYCHO	The Scythian			En la cima de Mingi Tau, subimos el Megatomo a la seguridad eterna del Arremolinado Infinito. #cheat #psycho					
END_CHEAT_LOVE	The Scythian			En la cima de Mingi Tau, subimos el Megatomo a la seguridad eterna del Arremolinado Infinito. #cheat #love			202	048.jpg	D4A81
END_MOONGROTTO_PSYCHO	The Scythian			En la cima de Mingi Tau, subimos el Megatomo a la seguridad eterna del Arremolinado Infinito. #moongrotto #psycho			180	049.jpg	74D9P
END_MOONGROTTO_LOVE	The Scythian			En la cima de Mingi Tau, subimos el Megatomo a la seguridad eterna del Arremolinado Infinito. #moongrotto #love			176	050.jpg	Y5F0P
END_HONEST_PSYCHO	The Scythian			En la cima de Mingi Tau, subimos el Megatomo a la seguridad eterna del Arremolinado Infinito. #honest #psycho			179	051.jpg	M5C1H
END_HONEST_LOVE	The Scythian			En la cima de Mingi Tau, subimos el Megatomo a la seguridad eterna del Arremolinado Infinito. #honest #love			177	052.jpg	55E2B
END_HONEST_NOBOOR	The Scythian			En la cima de Mingi Tau, subimos el Megatomo a la seguridad eterna del Arremolinado Infinito. #honest #noboor			178	053.jpg	75G3V
GIRL_GHOULTHOUGHTS	Girl			¿Sabe La Escita que es posible detener a la Masa Gogolítica tocando su cráneo con Espadancia? Probablemente no.					
				Espero que La Escita sepa que debe mantener pulsado el camino para mover, mover el bote bien rápido... si no lo hace, estará frita.					
				¿Dónde estoy? ¿Qué ha pasado? Lo último que recuerdo es que estaba paseando en sueños por el bosque cuando vi una inquietante luz rosada.					
LOGFELLA_GHOULTHOUGHTS	Logfella			La Escita sigue hablando sobre su funesto cometido de abrir una entrada al Arremolinado Infinito en la cima de Mingi Tau.					
				Todo ha sido una locura lunática desde que La Escita apareció hace muchas lunas.					
LOGFELLA_GHOUL	The Scythian			Cerca del Claro Trigonal, despertamos aturdidos de un sueño muy profundo, con Tronquero a nuestro lado.			88	054.jpg	J5D44
				Él nos contó que Samae había desaparecido la noche anterior.					
				El leñador sabía que nuestro fin estaba cerca y que debíamos volver a Mingi Tau para cumplir nuestro funesto cometido.					
LOGFELLA_TRIGONGROVETIPS	The Scythian			Tronquero nunca antes había visto el Claro Trigonal y se preguntaba de qué se trataba todo aquello.					
LOGFELLA_TRIFECTATIPS	The Scythian			Tronquero sentía una profunda tristeza por la ausencia de Samae.					
				Le dijimos que sabíamos dónde podría estar y que pronto arreglaríamos las cosas.					
				Él miró el pedestal cercano y nos agradeció de antemano por toda esa historia del martirio.					
URSULA_AVATAR			Ursula/idleSEhandsonhip						
DOG_AVATAR			AdventureUI/dudeDogfellaIdle1						
AMPHITHEATRE_LEFT	The Scythian	AdventureUI/tweetIconInfo		Estos dos personajes afirmaban ser parte de los creadores de este mundo tan raro.			159	055.jpg	A5G55
AMPHITHEATRE_RIGHT	The Scythian	AdventureUI/tweetIconInfo		Estos dos excéntricos afirmaban ser parte de los creadores de este mundo tan raro.			159	055.jpg	A5G55
GOURD_MOUNTAINMEADOW	The Scythian	AdventureUI/tweetIconGourd	gourd/gourd	Despertamos a un espíritu silvano en la fértil tierra de un prado habitado por cuatro pares de ovejas inútiles.			52	056.jpg	15B63
GOURD_CABIN	The Scythian	AdventureUI/tweetIconGourd	gourd/gourd	Entonamos la Canción de Espadancia y despertamos a un espíritu silvano de las frescas aguas de un estanque insondable, ¡Qué raro!			50	057.jpg	G5F78
GOURD_UPSLOPEWOODSONE	The Scythian	AdventureUI/tweetIconGourd	gourd/gourd	Despertamos a un espíritu silvano en un nido curioso, rodeado de tres empapados pájaros cantores.					
GOURD_UPSLOPEWOODSTWO	The Scythian	AdventureUI/tweetIconGourd	gourd/gourd	Despertamos a un espíritu silvano junto a un impasible puente de troncos, donde cuatro pares de árboles flanquean un impetuoso río.					
GOURD_UPSLOPEWOODSFOUR	The Scythian	AdventureUI/tweetIconGourd	gourd/gourd	Despertamos a un espíritu silvano entre dos odiosos arcoíris a la vera del Precipicio Peligroso.					
GOURD_WATERFALLS	The Scythian	AdventureUI/tweetIconGourd	gourd/gourd	Mientras La Luna Sombría reina, despertamos a un espíritu silvano rodeado por cinco cascadas.					
GOURD_MOUNTAINTOP	The Scythian	AdventureUI/tweetIconGourd	gourd/gourd	Mientras La Luna Sombría reina, despertamos a un espíritu silvano entre la maleza en lo alto de un peñasco rocoso.					
GOURD_SECRET2_STONESHELTER	The Scythian	AdventureUI/tweetIconGourd	gourd/gourd	Mientras La Luna Radiante impera, despertamos a un espíritu silvano en un claro oculto donde casualmente se encontraba Jim Guthrie.			132	058.jpg	G5F8U
GOURD_MOUNTAINLAKESHORE	The Scythian	AdventureUI/tweetIconGourd	gourd/gourd	Mientras La Luna Radiante impera, despertamos a un espíritu silvano en las tranquilas aguas de un lago donde una pata madre estaba angustiada.					
GOURD_LAKESHOREBUNNYSTRAIGHTAWAY	The Scythian	AdventureUI/tweetIconGourd	gourd/gourd	Mientras La Luna Radiante impera, despertamos a un espíritu silvano donde el reflejo del lago era ligeramente incongruente.			127	059.jpg	65D98
GOURD_LAKESHORELAKE	The Scythian	AdventureUI/tweetIconGourd	gourd/gourd	Mientras La Luna Radiante impera, despertamos a un espíritu silvano en un lago apacible bajo un terceto de búhos.					
GOURD_PINKCOLLECTED	The Scythian	AdventureUI/tweetIconGourd	Archetype/trifecta	Tenemos esa sensación peculiar de que, tal vez, estemos ante la temporada de milagros. #miracles					
GOURD_MOUNTAINSIDE	The Scythian	AdventureUI/tweetIconGourd	gourd/gourd	Mientras La Luna Sombría reina, despertamos a un espíritu silvano rodeado por tres pequeñas cascadas.					
GOURD_SECRET1_FOOTOFMOUNTAIN	The Scythian	AdventureUI/tweetIconGourd	gourd/gourd	Mientras La Luna Sombría reina, despertamos a un espíritu silvano rodeado de cuatro pequeños y redondos árboles en los bosques más oscuros.					
GOURD_BRISKLYWALKING	The Scythian	AdventureUI/tweetIconGourd	gourd/gourd	Mientras La Luna Sombría reina, despertamos a un espíritu silvano entre la maleza al otro lado del lago.					
GOURD_HUGETREE	The Scythian	AdventureUI/tweetIconGourd	gourd/gourd	Mientras La Luna Radiante impera, despertamos a un espíritu silvano acechando en la raíz de un titánico árbol.					
GOURD_BLUECOLLECTED	The Scythian	AdventureUI/tweetIconGourd	Archetype/trifecta	Tenemos esa sensación peculiar de que, tal vez, estemos ante la temporada de milagros. ¿Dónde están mis milagros? #miracles			77	060.jpg	86D06
GCLUE_MOUNTAINMEADOW	Dogfella	AdventureUI/tweetIconGourd		Guau Guau Guau Guau Guau Guau. #barking			135	061.jpg	M6F1I
				Guau Guau Guau. #justbarking					
				A veces me canso de ladrar tanto, pero un perro hace lo que un perro tiene que hacer.					
				Guau Snif Guau. #mixingitup					
				Guau Guau Guau Guau Guau Guau.					
GCLUE_UPSLOPEWOODSONE	Girl	AdventureUI/tweetIconGourd		Hay algo extraño en cómo se comportó La Escita, casi como si estuviera siendo controlada por una fuerza invisible.					
				Me gustaría saber más sobre la épica historia de La Escita, apuesto a que entonces todo tendría sentido.					
GCLUE_UPSLOPEWOODSTWO	Logfella	AdventureUI/tweetIconGourd		Ojalá La Escita esté ocupándose de lo de los espíritus silvanos.					
				Esta tormenta me tiene tan molesto, me hace desear que los videojuegos existieran en... en el momento en que se supone que estamos.					
GCLUE_UPSLOPEWOODSFOUR	Girl	AdventureUI/tweetIconGourd		Todo ha sido una locura lunática desde que La Escita apareció.			3	062.jpg	36E2Z
GCLUE_YELLOWCOLLECTED	Girl	AdventureUI/tweetIconGourd		Esta tormenta me tiene muy cansada. ¡Todo ha estado taaan lúgubre!					
				La lluvia ha comenzado a ceder y el cielo parece aclararse... ¿Será esta la temporada de milagros? Espero que así sea, adoro los milagros.					
				Vaya... ¿Qué? Las ovejas del prado se han asustado... Me pregunto qué estará pasando. ¿Podría ser... el Trigón Dorado?					
GCLUE_MOUNTAINTOP	Dogfella	AdventureUI/tweetIconGourd		Guau Guau Guau.					
				A veces, cuando las cosas están muy oscuras para mí, ingiero algo y veo incluso lo que no está ahí.					
				Guau Guau Guau Guau Guau.					
GCLUE_SECRET2_STONESHELTER	Logfella	AdventureUI/tweetIconGourd		Tengo esta melodía en la cabeza... una cancioncita alegre y triste que me llena de un miedo extrañamente hermoso.					
GCLUE_MOUNTAINLAKESHORE	Dogfella	AdventureUI/tweetIconGourd		Sé que buscas evitar tu funesto cometido, pero debes saber esto: el tiempo es una fuerza y, sin duda, seguirá su curso.					
				Guau Guau Guau. Snif.					
GCLUE_LAKESHOREBUNNYSTRAIGHTAWAY	Dogfella	AdventureUI/tweetIconGourd		Pero también existen los desconocidos desconocidos: las cosas que no sabemos que no sabemos.					
				Existen los desconocidos conocidos: las cosas que sabemos que no sabemos.			32	063.jpg	L6E31
				Guau Guau Guau.					
GCLUE_LAKESHORELAKE	Logfella	AdventureUI/tweetIconGourd		Mis troncos guardan muchos secretos sobre espíritus silvanos e islas imposibles. Lamentablemente, no hablo Tronqués.					
				En mi experiencia, a veces los búhos 'no son lo que parecen', mientras que otras veces son solo búhos comunes y corrientes.			126	064.jpg	86A47
GCLUE_PINKCOLLECTED	The Archetype	AdventureUI/tweetIconGourd		Tal vez oíste hablar de una isla imposible bajo La Luna Radiante... ¿Quizá lo leíste en internet?			134	065.jpg	H6A5I
				Hemos estado monitoreando tus acciones en silencio y queremos señalar que, cuanto más tardes en decidir, más pequeña será la celebración.					
				Parece que has progresado bastante en tu esfuerzo para localizar y domar el Trigón Luna Radiante, ¡Muy bien hecho!					
