id	user	icon	portrait	English	Japanese	Final Notes	pic	Filenames	Codes
GCLUE_MOUNTAINSIDE	Girl	AdventureUI/tweetIconGourd		¿Son los espíritus silvanos hijos de la Madre Tierra o son visitantes solitarios del Arremolinado Infinito?					
				Para ser honesta, los espíritus silvanos me dan escalofríos. Es decir... ¿Qué son? ¿De dónde vienen?					
GCLUE_SECRET1_FOOTOFMOUNTAIN	Dogfella	AdventureUI/tweetIconGourd		Cuando los espíritus hayan sido enviados al cielo y la temporada de milagros se acerque, debes buscar el titánico árbol.					
				Sé que sabes lo que sé y quiero que sepas que estás completamente en lo correcto.			109	066.jpg	F6D6H
				Guau Guau Guau Snif Guau Guau Guau.					
GCLUE_BRISKLYWALKING	Dogfella	AdventureUI/tweetIconGourd		Solo el fin de tu funesto cometido traerá la paz de vuelta a nuestras vidas.					
				Solo la Trífida Trigonal te permitirá comprender los secretos del Claro Trigonal.					
				El Arremolinado Infinito en la cima de Mingi Tau te espera.					
				Guau Guau Guau.					
GCLUE_WATERFALLS	Girl			¿Alguna vez has notado que a veces las palabras suenan como simple ruido, pero otras veces el ruido produce el sonido más bello?			132	058.jpg	G5F8U
GCLUE_HUGETREE	Logfella	AdventureUI/tweetIconGourd		Hay un montón de dichos extraños aquí entre los montañeses del Cáucaso.					
				Hay un dicho aquí en el Cáucaso que dice que un bosque necesita un fuego tanto como el fuego necesita al árbol.					
YELLOWTRIGON_COLLECTED	The Scythian			Conseguimos El Trigón Dorado. ¡Somos lo máximo!			85	067.jpg	36G7U
PINKTRIGON_COLLECTED	The Scythian			Contra todo pronóstico, conseguimos el Trigón Luna Radiante.			155	068.jpg	56F8U
BLUETRIGON_COLLECTED	The Scythian			A pesar de todo, conseguimos el Trigón Luna Sombría.			112	069.jpg	T6G94
GCLUE_BLUECOLLECTED	Girl	AdventureUI/tweetIconGourd		Parece que todos los espíritus de La Luna Sombría fueron enviados al cielo, así que de nuevo es temporada de milagros. ¡Adoro los milagros!					
JIM_HINT1_OFF	The Scythian			En un claro oculto, nos encontramos con un misterioso músico junto a un fuego crepitante.					
JIM_PINKDAWN	The Scythian			En un claro oculto, nos encontramos con un misterioso músico junto a un fuego crepitante. #jimguthrie					
JIM_BRIGHTMOON	The Scythian			Mientras La Luna Radiante impera, nos encontramos con un misterioso músico junto a un fuego crepitante, quien se presentó como Jim Guthrie.			128	070.jpg	07G00
JIM_POSTSWORCERY	The Scythian			El misterioso músico conocido como Jim Guthrie había presenciado nuestra Espadancia y no pareció importarle.					
JIM_POSTGOURD	The Scythian			El misterioso músico conocido como Jim Guthrie dijo que estaba listo para tocar una pequeña canción si queríamos escucharla.					
				Jim nos invitó a sentarnos junto al fuego.					
JIM_POSTSONG	The Scythian			Jim Guthrie nos enseñó que no se pueden negar los malos pensamientos, del mismo modo que no se puede negar la mordida de un dragón.					
			Archetype/trifecta	Él nos contó acerca de un concierto de rock que tenía programado tocar al otro lado del lago dentro de una quincena.					
JIM_LOGFELLATHOUGHTS	Logfella			La canción suena tan familiar... ¿Dónde la he escuchado antes? #1000songs					
				De repente, tengo una melodía en la cabeza de lo más curiosa. #andwegotolder					
LOGFELLA_JIMTHOUGHTS	Logfella			He tenido esta cancioncita en mi cabeza durante años... solo unas pocas notas que se repiten una y otra vez. Me pregunto qué significa eso.					
ARCHETYPE_OTHERSIDEOFLAKE	The Archetype			Cruzar de manera segura el umbral de la liminalidad es sencillo: busca los lugares familiares y el calor del hogar.					
				Si logras estabilizar tu lucidez, podrás co-crear con ella... en lugar de luchar, resistir y maldecirla.					
				Cuando estás lúcido en un sueño, te das cuenta de quién has imaginado ser... pero identificarse con el sueño es dejarse hechizar.					
				Incluso en un sueño ya conocido, hay nuevos lugares para explorar y nuevas conexiones para considerar... si sigues creyendo.					
GIRL_MOONGROTTOCOMMENT	Girl			Siento como si el cosmos hubiera dado un giro y ahora todo estuviera levemente... desajustado.					
LOGFELLA_MOONGROTTOCOMMENT	Logfella			De 0 a 1 hay un largo trecho, y si un alien dijera 'hola', sería un código críptico en la radio. Espera... ¿Qué?					
GIRL_HUGETREETHOUGHTS	Girl			Por supuesto, nunca le cuento a la gente sobre estos sueños de diosas y árboles, pues seguramente me tomarían por una soñadora.					
				En mi lugar especial visito un titánico árbol hueco... ella es una diosa, muerta hace mucho, que antecede a la humanidad por eras.					
				En mi sueño hay un lugar especial al que siempre voy, un Parlamento de Árboles en el corazón del mundo.					
LOGFELLA_HUGETREETHOUGHTS	Logfella			Me encanta ver los mismos bosques con diferente clima y simplemente detenerme a escuchar... y pensar o no pensar, según sea el caso.					
				No paso mucho tiempo paseando por mis sueños, pero cuando lo hago tiendo a volver a visitar mis lugares favoritos para ver lo que ha cambiado.					
MIRACLE1_MOUNTAINMEADOW	The Scythian			En un prado soleado, obramos un milagro disipador de tormentas, al estilo plegable del gran mago 'Al Jaffee'.					
MIRACLE1_YELLOWTRIGONCOLLECTED	The Scythian			En un prado soleado, despertamos confundidos y aturdidos, con un dolor de cabeza terrible.					
LOGFELLA_YELLOWTRIGONCOLLECTED	The Scythian			Aturdidos y sin un recuerdo claro, despertamos de un sueño muy profundo.					
			triangle/Triangle	Recordamos el milagro en el prado y nuestro encuentro con el Trigón Dorado...					
			triangle/Triangle	...¿Qué nuevos poderes se nos han otorgado?					
			triangle/Triangle	Tronquero quedó totalmente asombrado por lo impresionante y extraña que sonaba la pelea con el Trigón Dorado.			81	071.jpg	R7C14
			triangle/Triangle	Se preguntó por la conexión del Trigón Dorado con los misterios siniestros más allá del portón de hierro en el prado.					
				A Tronquero no le iban los misterios siniestros, así que decidió irse a casa y cortar leña. #woodchopping					
LOGFELLA_BEFOREYELLOWBEAM	The Scythian			Tronquero estaba muy contento de que la tormenta se hubiera disipado y estaba muy entusiasmado por volver a cortar leña.					
				Nos preguntó si teníamos idea sobre el portón de hierro que bloqueaba la vasta cueva del prado... ¿qué podría haber detrás?					
LOGFELLA_YELLOWTRIGONTHOUGHTS	Logfella			Que extraño... Veo un haz celestial dorado en el bosque tras el prado... ¿Alguien ha descubierto los secretos del Claro Trigonal?			89	072.jpg	67F24
LOGFELLA_URSULAMEADOW	Logfella			Estoy realmente preocupado por La Escita, parece muy afectada.					
SCYTHIAN_YELLOWTRIGONCOLLECTED_OFF	The Scythian			El leñador y su hija nos observaron mientras recuperábamos el conocimiento.					
				El prado seguía igual, toda evidencia de nuestro encuentro onírico había desaparecido.					
GIRL_YELLOWTRIGONCOLLECTED	The Scythian			Samae escuchó en silencio nuestra extraña historia sobre nuestro encuentro con el Trigón Dorado.					
			triangle/Triangle	Se preguntó por los secretos del Claro Trigonal más allá de la vasta cueva del prado... ¿Habría alguna conexión?					
GIRL_YELLOWTRIGONTHOUGHTS	Girl			Hmm... Me preocupa mucho La Escita... desapareció por varios días después de que se disipara la tormenta. Ojalá esté bien.					
GIRL_URSULAMEADOW_OFF	Girl			Vaya, ¿Entonces La Escita estaba desmayada en el prado? Qué locura.					
DOGFELLA_GETDARKTRIGON	The Scythian			Después de activar otro haz celestial en el Claro Trigonal, notamos algo peculiar en el perro llamado Perrero.					
			Archetype/trifecta	De repente parecía que entendíamos a Perrero, nos instó a buscar el Trigón Luna Sombría y completar la Trífida Trigonal.					
DOGFELLA_GETBRIGHTTRIGON	The Scythian			Después de activar otro haz celestial en el Claro Trigonal, notamos algo peculiar en el perro llamado Perrero.					
			Archetype/trifecta	De repente parecía que entendíamos a Perrero, nos instó a buscar el Trigón Luna Radiante y completar la Trífida Trigonal.					
DOGFELLA_THREETRIGONS	The Scythian			Después de activar otro haz celestial en el Claro Trigonal, notamos algo peculiar en el perro llamado Perrero.					
			Archetype/trifecta	De repente parecía que entendíamos a Perrero, nos instó a activar el tercer haz celestial y abrir la entrada al Arremolinado Infinito.					
DOGFELLA_TRUTHBOMB	Dogfella			Guau Guau Guau.					
				Guau Guau Snif Guau.					
				El cosmos en el Arremolinado Infinito en la cima de Mingi Tau espera a quien lleva el Megatomo.					
				Guau Guau Guau Guau Guau.					
				Guau Guau Guau.					
GIRL_AFTERYELLOWBEAM	The Scythian			Samae se sentó en una roca cerca del lugar donde el leñador cortaba leña.					
			Archetype/trifecta	Le preguntamos por los secretos del Claro Trigonal y los peculiares sueños de los montañeses del Cáucaso.					
				Ella nos contó cómo los sueños de su gente contenían muchos misterios y reflejaban el humor de la luna de manera extraña.					
				Nos invitó a sentarnos junto al fuego en la choza de piedra cuando quisiéramos, para explorar los sueños o recobrar fuerzas.					
			Archetype/trifecta	Presentimos que los dos trigones restantes podrían estar perdidos en los sueños.					
LOGFELLA_AFTERYELLOWBEAM	The Scythian			Tronquero había regresado a cortar leña, y parecía disfrutarlo muchísimo.					
			triangle/Triangle	Había visto el haz celestial que se alzaba tras el prado, así que le preguntamos por los secretos del Claro Trigonal.					
				Nos relató una vieja historia que su gente contaba a sus hijos para provocarles escalofríos.					
			Archetype/trifecta	Habló de una partida de escitas que, hace muchas lunas, llegó a estas montañas olvidadas en busca de la Trífida Trigonal.					
			gourd/gourd	"""Aquella partida aprendió a hallar a los espíritus silvanos y enviarlos al cielo... y después buscó un lugar donde obrar un milagro."""					
			Archetype/trifecta	"""Esperaban activar los tres haces celestiales en el Claro Trigonal, pero desconocían dónde o cuándo aparecerían los trigones."""					
				"""Vagaron sin rumbo durante largo tiempo por el antiguo camino hacia Mingi Tau... hasta que, exhaustos, se detuvieron."""					
				"""Entonces, un espectro inmortal los diezmó a la vera del antiguo camino, donde aún hoy permanecen sus tumbas."""					
				Le dijimos a Tronquero que era una buena historia, aunque no nos asustó demasiado.					
GIRL_GRAVESCOMPLETETHOUGHTS	Girl								
ARCHETYPE_MOONGROTTO	The Archetype			Veo que has logrado alterar el humor de la luna en la Gruta Lunar. Me pregunto cuánto durará esta paradoja temporal.					
MIRACLE2_ISLAND	The Scythian			Mientras La Luna Radiante impera, obramos un extraño milagro lunar en una isla imposible en medio de un lago apacible.			136	073.jpg	W7A3K
MIRACLE2_PINKTRIGONCOLLECTED	The Scythian			Conseguimos el Trigón Luna Radiante, para nuestra gloria y desesperación. #trigontamed			155	068.jpg	56F8U
MIRACLE2_BRIGHTMOONTRIGONCOLLECTED	The Scythian			Nos tentó abandonar por completo este funesto cometido, pero había algo atractivo en el martirio.					
				En fin, probablemente no importará mucho. Total, para entrar al Arremolinado Infinito no hace falta un examen físico.					
				Era evidente que tantos paseos oníricos y trigones domados empezaban a pasar factura.					
				Al amainar la luz y el sonido, nos encontramos en la orilla de un lago con un fuerte dolor de cabeza y la nariz ensangrentada.					
GIRL_BRIGHTMOONTRIGONCOLLECTED	The Scythian		Archetype/trifecta	Hablamos con Samae sobre nuestro encuentro onírico con el Trigón Luna Radiante y de nuestras intenciones de reconstruir la Trífida Trigonal.					
				Dijo que nuestro encuentro en sueños sonaba fascinante y lamentó no haber estado presente. #lies					
				Nos preguntó si habíamos pasado por el Claro Trigonal... ¿Quizá podríamos activar otro haz celestial?					
LOGFELLA_BRIGHTMOONTRIGONCOLLECTED	The Scythian			El leñador veía que nuestros paseos oníricos y el obrar de milagros habían pasado factura a nuestra salud física.					
				Él parecía sospechar que nuestro funesto cometido no acabaría bien.					
				Nos recordó que podíamos sentarnos junto al fuego de la choza y descansar de vez en cuando para recobrar fuerzas.					
ARCHETYPE_BRIGHTMOONTRIGONCOLLECTED	The Archetype			Nuestros datos de investigación muestran una alta correlación entre el progreso de un participante en S:S&S EP y su aptitud para ser genial.			45	074.jpg	87A43
				Veo que has logrado localizar y recuperar el Trigón Luna Radiante. Es una noticia realmente extraordinaria.					
MIRACLE3_HUGETREE	The Scythian			Mientras La Luna Sombría reina, obramos un milagro de rayo fragmentador en medio de un Parlamento de Árboles.					
MIRACLE3_DARKMOONTRIGONCOLLECTED	The Scythian			Además... llevar el Megatomo a todas partes es algo molesto, es un libro realmente pesado en más de un sentido.					
				Nos sentíamos algo consumidos... probablemente tenía algo que ver con el fulgor de aquellos odiosos arcoíris.					
				Al amainar la luz y el sonido, nos encontramos empapados por la fría lluvia en medio de un Parlamento de Árboles.					
GIRL_DARKMOONTRIGONCOLLECTED	The Scythian		Archetype/trifecta	Hablamos con Samae sobre nuestro encuentro onírico con el Trigón Luna Sombría y de nuestras intenciones de reconstruir la Trífida Trigonal.					
				Le contamos cómo habíamos neutralizado el odioso ataque arcoíris del Trigón Luna Sombría y ella asintió con interés.					
				No parecía importarle escuchar nuestras historias extravagantes.					
LOGFELLA_DARKMOONTRIGONCOLLECTED	The Scythian			El leñador veía que nuestros paseos oníricos y el obrar de milagros habían pasado factura a nuestra salud física.					
			Archetype/trifecta	Tronquero nos preguntó si habíamos visitado a Perrero en el Claro Trigonal... ¿Quizá podríamos activar otro haz celestial?					
ARCHETYPE_DARKMOONTRIGONCOLLECTED	The Archetype			Ahora la pregunta es... ¿Qué sigue?					
				A pesar de la escasez de información útil que hemos proporcionado, has logrado dominar el Trigón Luna Sombría.					
				Me han informado que has recuperado el Trigón Luna Sombría. Es una noticia realmente extraordinaria.					
LOGFELLA_FOUNDBOORKEY	The Scythian		AdventureUI/keyItem	El leñador no reconoció la llave que encontramos y no tenía ni idea de para qué era.					
			AdventureUI/keyItem	¿...?					
GIRL_FOUNDBOORKEY	The Scythian		AdventureUI/keyItem	Samae vio la llave que encontramos y nos animó a estar atentos por si veíamos una puerta trancada.					
				Ella no tenía ninguna otra idea, pero recordamos algo que habíamos visto en el antiguo camino hacia Mingi Tau.					
ARCHETYPE_GROTTOPARADOX	The Archetype								
				Una vez que el humor de la luna ha sido alterado en la Gruta Lunar...					
ARCHETYPE_KILLBOOR	The Archetype			Ahora, me imagino que te preguntarás para qué sirve esa llave. Para ser honesto, no tengo ni idea.			119	075.jpg	87C5S
				No es que esté sugiriendo que en realidad seas un sociópata violento... jeje... Estoy seguro de que tenías tus razones, ¿o me equivoco? #thegrizzledboor					
				El Canoso Tosco fue incluido en S:S&S EP para tentar a los participantes a identificarse como sociópatas violentos.					
				Me han informado de que el Canoso Tosco ha sido asesinado... ¿Sabes algo al respecto? #slaughter					
ARCHETYPE_SPAREBOOR	The Archetype			Ahora, me imagino que te preguntarás para qué sirve esa llave. Para ser honesto, no tengo ni idea.			119	075.jpg	87C5S
				Sí, eso es increíble y te queremos muchísimo por eso.					
				El Canoso Tosco fue incluido en S:S&S EP para permitir que los participantes se identificaran a sí mismos como personas compasivas y razonables.					
				Me han informado de que el Canoso Tosco ha podido escapar ileso. Es una noticia alentadora.					
LOGFELLA_FOUNDATION	Logfella	AdventureUI/tweetIconBabelBook		...					
				...					
				...					
SCYTHIAN_FOUNDATION	The Scythian			Despertamos a un espíritu silvano en un estanque insondable con lirios junto a una choza de piedra. No sabemos qué significa.					
				Con una tormenta incesante, aprendimos a entonar la Canción de Espadancia y a despertar a un espíritu silvano dormido.					
				Espera... ¿Por qué hablo en primera persona? ¿No se supone que la historia va en segunda persona? #editingoversight					
				¿Mis pensamientos van en orden? ¿Esto es lo que pensaba hace unos segundos...?					
				¿Esto es el Megatomo? ¿Absorbe 'transmisiones de pensamiento lingüístico'? ¿Estoy leyendo mis pensamientos mientras los pienso? Hmm...					
GIRL_FOUNDATION	Girl	AdventureUI/tweetIconBabelBook		...					
				...					
				...					
DOGFELLA_FOUNDATION	Dogfella	AdventureUI/tweetIconBabelBook		...					
				...					
				...					
LOGFELLA_DARKMOON	The Scythian			El leñador habló sobre paseos oníricos por el bosque en la hora antes del amanecer, bajo un cielo oscuro y tormentoso.					
				Mencionó una inquietante luz rosada y una misteriosa canción que surgían del bosque sin nombre tras el prado.					
				Supusimos que Tronquero se refería probablemente al concierto de rock de La Luna Sombría.					
GIRL_DARKMOON	The Scythian			Samae habló sobre paseos oníricos por el bosque en la hora antes del amanecer, bajo un cielo oscuro y tormentoso.					
				Comentó cómo se había refugiado de la tormenta en un árbol hueco de proporciones titánicas.					
				Sabíamos exactamente a qué titánico árbol hueco se refería.					
ARCHETYPE_DARKMOON	The Archetype			Ten cuidado. La Luna Sombría reina.			94	076.jpg	I7F69
LOGFELLA_CRESCENTWAX	The Scythian			El leñador habló sobre paseos oníricos por el bosque en la hora antes del amanecer, bajo la luz de una luna creciente.					
				Habló acerca de una criatura que había encontrado, algo o alguien extraño y desnudo. ¿Era un oso? ¿Un hombre? O... ¿El Canoso Tosco?			57	077.jpg	I7G7U
GIRL_CRESCENTWAX	The Scythian			Samae estaba emocionada, ¡Hoy comenzaba un nuevo mes lunar! Le esperaban largos días sentada sobre rocas.					
ARCHETYPE_CRESCENTWAX	The Archetype			Un destello de luna creciente ha aparecido, marcando el inicio de un nuevo ciclo lunar de veintiocho días.			118	045.jpg	Y4E5Q
LOGFELLA_HALFWAX	The Scythian			El leñador admitió que sí, de hecho, había cortado una buena cantidad de leña en su vida.					
				Habló de fríos inviernos y profundas nevadas aquí, en las majestuosas montañas del Cáucaso, que se alzaban sobre las estepas de Escitia.					
				El leñador esperaba tener suficiente comida y leña para sobrevivir los largos y fríos meses venideros.					
GIRL_HALFWAX	The Scythian			En mi sueño de anoche, estaba caminando por el bosque y tenía un antojo terrible de un muffin, pero no había ni uno solo.			108	078.jpg	07D87
ARCHETYPE_HALFWAX	The Archetype			Algunos folcloristas lunáticos afirman que no existe una relación causal entre la locura y el humor de la luna.					
LOGFELLA_ALMOSTWAX	The Scythian			El leñador dijo que nunca solía pensar demasiado en la Masa Gogolítica y en la montaña desierta de Mingi Tau.					
				Sin embargo, mencionó que últimamente la presencia espectral de la Masa Gogolítica había comenzado a acosarlo.					
				El leñador admitió que le daban escalofríos cuando La Luna Radiante impera... y cuando La Luna Sombría reina.					
GIRL_ALMOSTWAX	The Scythian			Samae comentó algo sobre la luna creciente y se preguntó cuánto tiempo pasaría hasta que La Luna Radiante imperara en el cielo.					
ARCHETYPE_ALMOSTWAX	The Archetype			La luna crece un poco cada día... en unos pocos días, La Luna Radiante imperará... ¿Y qué?			165	046.jpg	P4B6A
LOGFELLA_BRIGHTMOON	The Scythian			El leñador admitió que su perro se comportaba de manera extraña cada vez que La Luna Radiante impera en el cielo.			135	061.jpg	M6F1I
GIRL_BRIGHTMOON	The Scythian			Samae habló sobre paseos oníricos por el bosque en la hora antes del amanecer, con La Luna Radiante imperando en el cielo.					
				Mencionó el aire fresco de la mañana y una isla imposible en medio de un lago apacible.					
ARCHETYPE_BRIGHTMOON	The Archetype			Sal afuera y mira hacia arriba. ¡Maravíllate con La Luna Radiante que impera en el cielo!			95	079.jpg	07D95
LOGFELLA_ALMOSTWANE	The Scythian			Al leñador no le iban mucho las historias y admitió que normalmente se quedaba dormido, aunque poseía un buen conocimiento al respecto.					
				El leñador era conocedor de todos los detalles sobre Mingi Tau y por qué era conocido como el Reino de las Nubes.					
				Sabía que Mingi Tau era la montaña más alta del mundo conocido, incluso más que el Monte Olimpo, donde habitaban los dioses aqueos.					
				Asimismo, sabía que la cima de Mingi Tau, siempre envuelta en nubes, era considerada la entrada al Arremolinado Infinito.					
				El leñador nunca se había atrevido a poner un pie en las temibles laderas de Mingi Tau, y nunca lo haría.					
GIRL_ALMOSTWANE	The Scythian			Samae se preguntó por qué tantos hongos crecían justo antes y después de La Luna Radiante... ¿A qué se debería?					
ARCHETYPE_ALMOSTWANE	The Archetype			La luna está ligeramente menos brillante que ayer, y el ciclo lunar está comenzando a disminuir.					
LOGFELLA_HALFWANE	The Scythian			Al leñador no le iban mucho las historias y admitió que normalmente se quedaba dormido, aunque poseía un buen conocimiento al respecto.					
				El leñador explicó que en Escitia y Persia, Mingi Tau era conocida como La Montaña Eterna.					
				El leñador relató cómo, hace siglos, una raza olvidada había tallado un templo en la roca bajo Mingi Tau.					
				El leñador mencionó los pasajes subterráneos y los espacios cavernosos tallados en la roca bajo Mingi Tau.					
				Según el leñador, esos espacios cavernosos fueron tallados hace siglos para proteger el Megatomo.					
GIRL_HALFWANE	The Scythian			Samae dijo haber caminado más allá del muro de piedra y haber sentido la terrible presencia de la Masa Gogolítica.			30	080.jpg	V8B04
ARCHETYPE_HALFWANE	The Archetype			El ciclo lunar está disminuyendo y La Luna Sombría está a poco menos de una semana de distancia.					
LOGFELLA_CRESCENTWANE	The Scythian			Al leñador no le iban mucho las historias y admitió que normalmente se quedaba dormido, aunque poseía un buen conocimiento al respecto.					
				El leñador conocía la historia de la Masa Gogolítica, el espectro inmortal que acechaba en la oscuridad bajo Mingi Tau.					
				Tronquero habló del Arremolinado Infinito, más allá de nuestra comprensión, de donde provino el Megatomo en la apenas recordada Edad de Piedra.					
				Habló de seres inmortales del espacio que despertaron en la humanidad una forma rudimentaria de transmisión de pensamiento.					
				"""Estos inmortales dieron a la humanidad el don de la civilización, y con ello, la condena de una inevitable extinción."""					
				"""Los escitas trataron de reprimir la insidiosa propagación de la civilización y por eso aislaron el Megatomo con su protector inmortal."""					
				"""El inmortal ha acechado en la oscuridad desde entonces, degenerándose en el espectro conocido como la Masa Gogolítica."""					
				Probablemente habría seguido con esta historia interminable si no lo hubiéramos interrumpido respetuosamente.					
GIRL_CRESCENTWANE	The Scythian			Samae observó la luna menguante. Dijo que pronto se iría y La Luna Sombría reinaría.					
ARCHETYPE_CRESCENTWANE	The Archetype			El ciclo lunar está casi completo. La Luna Sombría está muy cerca.					
DARKMOONLOOMS_ARCHETYPE	The Archetype			La Luna Sombría reina, el final del ciclo lunar está muy cerca.					
DARKMOONBEGINS_ARCHETYPE	The Archetype			He aquí, ¡La Luna Sombría!			94	076.jpg	I7F69
DARKMOON_GIRLTHOUGHTS	Girl			En mi sueño me encontré con un Parlamento de Árboles azotado por un rayo y sentí la presencia de algo profundamente sagrado.					
DARKMOON_LOGFELLATHOUGHTS	Logfella			Anoche escuché el sonido de una música vibrante que se filtraba por los bosques detrás de mi choza. ¿Qué podría ser?					
DARKMOON_DOGFELLATHOUGHTS	Dogfella			Guau Guau Guau. En mi estado de sueño solo vislumbré las sutiles y melodiosas brumas de los espíritus silvanos.					
AMPHITHEATRE_OUTRO	The Scythian			Reconstruimos la Trífida Trigonal y ahora somos héroes.			164	081.jpg	48G1Q
RABBITS_3MURDERS	The Scythian			Sin razón aparente, hemos acabado con la vida de 3 conejos indefensos.					
RABBITS_7MURDERS	The Scythian			Sin razón aparente, hemos acabado con la vida de 7 conejos indefensos. ¿Es esto evidencia de una mente trastornada?					
RABBITS_13MURDERS	The Scythian			Sin razón aparente, hemos acabado con la vida de 13 conejos indefensos.					
RABBITS_17MURDERS	The Scythian			Sin razón aparente, hemos acabado con la vida de 17 conejos indefensos. Somos imparables.					
RABBITS_23MURDERS	The Scythian			Sin razón aparente, hemos acabado con la vida de 23 conejos indefensos.					
RABBITS_37MURDERS	The Scythian			Sin razón aparente, hemos acabado con la vida de 37 conejos indefensos. Nos da curiosidad saber qué pasará si continuamos con esta masacre.					
RABBITS_53MURDERS	The Scythian			Sin razón aparente, hemos acabado con la vida de 53 conejos indefensos. Claramente, sufrimos de un trastorno obsesivo-compulsivo.					
RABBITS_91MURDERS	The Scythian			Sin razón aparente, hemos acabado con la vida de 91 conejos indefensos.					
RABBITS_107MURDERS	The Scythian			Sin razón aparente, hemos acabado con la vida de 107 conejos indefensos. ¿Quizá nuestra compulsión disminuya si dejamos de contar?					
