id	user	icon	portrait	English	Japanese	Final Notes	pic	Filenames	Codes
GCLUE_MOUNTAINLAKESHORE	Dogfella	AdventureUI/tweetIconGourd		Sé que buscas evitar tu funesto cometido, pero debes saber esto: el tiempo es una fuerza y, sin duda, seguirá su curso.					
				Guau Guau Guau. Snif.					
GCLUE_LAKESHOREBUNNYSTRAIGHTAWAY	Dogfella	AdventureUI/tweetIconGourd		También hay sustantivos desconocidos, aunque estos se aprenden fácilmente.					
				Hay dos tipos de incógnitas, las incógnitas conocidas y las incógnitas desconocidas.			32	063.jpg	L6E31
				Guau Guau Guau. 					
GCLUE_LAKESHORELAKE	Logfella	AdventureUI/tweetIconGourd		Mis troncos guardan muchos secretos... secretos sobre los Espíritus Silvanos e islas imposibles. Lamentablemente, no hablo Tronqués.					
				En mi experiencia, hay ocasiones en las que los búhos no son lo que parecen, mientras que en otras simplemente son búhos comunes y corrientes.			126	064.jpg	86A47
GCLUE_PINKCOLLECTED	The Archetype	AdventureUI/tweetIconGourd		Tal vez hayas oído hablar sobre una isla imposible bajo La Luna Radiante ...¿Quizás lo leíste en internet?			134	065.jpg	H6A5I
				Hemos estado monitoreando tus acciones en silencio y queremos señalar que mientras más tiempo tardes en decidir, más pequeña será la celebración.					
				Parece que has progresado bastante en tu esfuerzo para localizar y domar a el Trigón Luna Radiante, ¡Muy bien hecho!					
GCLUE_MOUNTAINSIDE	Girl	AdventureUI/tweetIconGourd		¿Son los Espíritus Silvanos hijos de la Madre Tierra o son visitantes solitarios del Arremolinado Infinito?					
				Para ser honesta, los Espíritus Silvanos me asustan bastante. Es decir... ¿Qué son? ¿De dónde vienen?					
GCLUE_SECRET1_FOOTOFMOUNTAIN	Dogfella	AdventureUI/tweetIconGourd		Cuando los espíritus hayan sido enviados al cielo y la temporada de milagros se acerque, debes buscar el árbol titánico.					
				Sé que sabes lo que sé y quiero que sepas que estás completamente en lo correcto.			109	066.jpg	F6D6H
				Guau Guau Guau Snif Guau Guau Guau.					
GCLUE_BRISKLYWALKING	Dogfella	AdventureUI/tweetIconGourd		Solo el final de tu funesto cometido traerá la paz de vuelta a nuestras vidas.					
				Solo La Tríada Trigonal te permitirá comprender los secretos de la Arboleda Trigonal.					
				El Arremolinado Infinito en la cima de Mingi Tau te espera.					
				Guau Guau Guau.					
GCLUE_WATERFALLS	Girl			¿Alguna vez has notado que a veces las palabras simplemente suenan como ruido, pero otras veces el ruido produce el sonido más bello?			132	058.jpg	G5F8U
GCLUE_HUGETREE	Logfella	AdventureUI/tweetIconGourd		Hay un montón de dichos extraños aquí, entre los montañeses del Cáucaso.					
				Hay un dicho aqui en el Cáucaso que dice que un bosque necesita un fuego tanto como el fuego necesita al árbol.					
YELLOWTRIGON_COLLECTED	The Scythian			Hemos conseguido El Trigón Dorado. Somos impresionantes.			85	067.jpg	36G7U
PINKTRIGON_COLLECTED	The Scythian			Contra todo pronóstico, hemos conseguido El Trigón Luna Radiante.			155	068.jpg	56F8U
BLUETRIGON_COLLECTED	The Scythian			A pesar de todas las adversidades, hemos conseguido El Trigón Luna Sombría.			112	069.jpg	T6G94
GCLUE_BLUECOLLECTED	Girl	AdventureUI/tweetIconGourd		Parece como si todos los espíritus Luna Sombría hubieran sido enviados al cielo, así que de nuevo es la temporada de milagros. ¡Adoro los milagros!					
JIM_HINT1_OFF	The Scythian			En un claro oculto nos encontramos con un misterioso músico junto a un fuego crepitante.					
JIM_PINKDAWN	The Scythian			En un claro oculto nos encontramos con un misterioso músico junto a un fuego crepitante. #jimguthrie					
JIM_BRIGHTMOON	The Scythian			Mientras que La Luna Radiante se alzaba, nos encontramos con un misterioso músico junto a un fuego crepitante, quien se presentó como Jim Guthrie.			128	070.jpg	07G00
JIM_POSTSWORCERY	The Scythian			El misterioso músico conocido como Jim Guthrie había presenciado nuestra Espadamancia y parecía estar bien con ello.					
JIM_POSTGOURD	The Scythian			El misterioso músico conocido como Jim Guthrie dijo que estaba listo para tocar una pequeña canción si queríamos escucharla.					
				Jim nos invitó a sentarnos junto al fuego.					
JIM_POSTSONG	The Scythian			Jim Guthrie nos había enseñado que no se podían negar los malos pensamientos, así como no se podía negar la mordedura de un dragón.					
			Archetype/trifecta	Él nos contó acerca de un concierto de rock que tenía programado tocar al otro lado del lago dentro de una quincena.					
JIM_LOGFELLATHOUGHTS	Logfella			La canción suena tan familiar... ¿Dónde la he escuchado antes? #1000songs					
				De repente, tengo esta melodía extrañamente genial en mi cabeza. #andwegotolder					
LOGFELLA_JIMTHOUGHTS	Logfella			He tenido esta pequeña canción en mi cabeza durante años... solo unas pocas notas que se repiten una y otra vez. Me pregunto qué significa eso.					
ARCHETYPE_OTHERSIDEOFLAKE	The Archetype			Cruzar de manera segura el umbral de la liminalidad es sencillo: busca los lugares familiares y el calor del hogar.					
				Si logras estabilizar tu lucidez, podrás co-crear con ella... en lugar de luchar, resistir y maldecirla.					
				Cuando estás lúcido en un sueño, te das cuenta de quién has imaginado ser... pero identificarse con el sueño es dejarse hechizar.					
				Incluso en un sueño ya conocido, hay nuevos lugares para explorar y nuevas conexiones para considerar... si sigues creyendo.					
GIRL_MOONGROTTOCOMMENT	Girl			Siento como si el cosmos hubiera dado un giro y ahora todo estuviera un poco... desajustado.					
LOGFELLA_MOONGROTTOCOMMENT	Logfella			Es un largo camino de 0 a 1, y si un extraterrestre dijera 'Hola', sería en un código críptico en el estéreo. Espera... ¿Qué?					
GIRL_HUGETREETHOUGHTS	Girl			Por supuesto, nunca le hablo a la gente sobre estos sueños de diosas y árboles porque probablemente solo me llamarían hippie o algo así.					
				En mi lugar especial visito a un árbol hueco titánico... ella es una diosa que hace mucho tiempo murió y que antecede a la humanidad por eras incontables.					
				En mi sueño hay un lugar especial al que siempre voy, un Parlamento de árboles en el corazón del mundo.					
LOGFELLA_HUGETREETHOUGHTS	Logfella			Me encanta ver los mismos bosques con diferente clima y me encanta simplemente detenerme y escuchar... y pensar o no pensar según sea el caso.					
				No paso mucho tiempo caminando por mis sueños, pero cuando lo hago tiendo a volver a visitar mis lugares favoritos para ver lo que ha cambiado.					
MIRACLE1_MOUNTAINMEADOW	The Scythian			Hemos realizado un milagro disipador de tormentas en un prado bañado por el sol, al estilo del mago loco Al Jaffee.					
MIRACLE1_YELLOWTRIGONCOLLECTED	The Scythian			Nos sentimos confundidos y desconcertados en un prado bañado por el sol, con uno de esos dolores de cabeza realmente intensos.					
LOGFELLA_YELLOWTRIGONCOLLECTED	The Scythian			Nos despertamos aturdidos de un sueño muy profundo sin un recuerdo claro de lo que había sucedido.					
			triangle/Triangle	Recordamos el milagro en el prado y nuestro encuentro con El Trigón Dorado... 					
			triangle/Triangle	...¿Qué nuevos poderes se nos han otorgado?					
			triangle/Triangle	Amileño quedó totalmente asombrado por lo impresionante y extraña que sonaba la pelea con el Trigón Dorado.			81	071.jpg	R7C14
			triangle/Triangle	Amileño se preguntaba si tal vez el Trigón Dorado podría estar relacionado con los misterios sombríos más allá del portón de hierro en el prado...					
				A Amileño no le gustaban los misterios sombríos, así que decidió ir a casa y cortar leña. #woodchopping					
LOGFELLA_BEFOREYELLOWBEAM	The Scythian			El leñador conocido como Amileño estaba muy contento de que la tormenta se hubiera disipado y estaba muy entusiasmado por volver a cortar leña.					
				Nos preguntó si sabíamos algo sobre el portón de hierro que bloqueaba la cueva cavernosa en el prado... ¿De qué se trataba eso?					
LOGFELLA_YELLOWTRIGONTHOUGHTS	Logfella			Extraño... Veo un rayo ascendente dorado en el bosque detrás del prado... ¿Alguien ha descubierto los secretos de la Arboleda Trigonal?			89	072.jpg	67F24
LOGFELLA_URSULAMEADOW	Logfella			Estoy realmente preocupado por La Escita, parece muy afectada.					
SCYTHIAN_YELLOWTRIGONCOLLECTED_OFF	The Scythian			El leñador y su hija nos observaron mientras recuperábamos el conocimiento.					
				Nos dimos cuenta de que el prado seguía igual, que toda evidencia de nuestro encuentro místico había desaparecido.					
GIRL_YELLOWTRIGONCOLLECTED	The Scythian			Samae escuchó en silencio nuestra extraña historia sobre nuestro encuentro con El Trigón Dorado.					
			triangle/Triangle	Se preguntó sobre los secretos de la Arboleda Trigonal más allá de la cueva cavernosa en el prado... ¿Habría alguna conexión?					
GIRL_YELLOWTRIGONTHOUGHTS	Girl			Hmm... Estoy realmente preocupada por La Escita... desapareció durante días después de que la tormenta se disipara. Espero sinceramente que esté bien.					
GIRL_URSULAMEADOW_OFF	Girl			Vaya, ¿Entonces La Escita estaba desmayada en el prado? Qué locura.					
DOGFELLA_GETDARKTRIGON	The Scythian			Después de activar otro rayo ascendente en la Arboleda Trigonal, notamos algo peculiar en el perro llamado Amican.					
			Archetype/trifecta	De repente parecía que entendíamos a Amican, nos instó a buscar El Trigón Luna Sombría y completar La Tríada Trigonal.					
DOGFELLA_GETBRIGHTTRIGON	The Scythian			Después de activar otro rayo ascendente en la Arboleda Trigonal, notamos algo peculiar en el perro llamado Amican.					
			Archetype/trifecta	De repente parecía que entendíamos a Amican, nos instó a buscar El Trigón Luna Radiante y completar La Tríada Trigonal.					
DOGFELLA_THREETRIGONS	The Scythian			Después de activar otro rayo ascendente en la Arboleda Trigonal, notamos algo peculiar en el perro llamado Amican.					
			Archetype/trifecta	De repente parecía que entendíamos a Amican, nos instó a activar el tercer rayo ascendente y abrir la entrada al Arremolinado Infinito.					
DOGFELLA_TRUTHBOMB	Dogfella			Guau Guau Guau.					
				Guau Guau Snif Guau.					
				El cosmos en el Arremolinado Infinito en la cima de Mingi Tau espera a aquel que lleva El Megatomo.					
				Guau Guau Guau Guau Guau.					
				Guau Guau Guau.					
GIRL_AFTERYELLOWBEAM	The Scythian			Samae se sentó en una roca cerca del lugar donde el leñador cortaba leña.					
			Archetype/trifecta	Le preguntamos sobre los secretos de la Arboleda Trigonal y los peculiares sueños de los montañeses del Cáucaso.					
				Ella nos contó cómo los sueños de su gente contenían muchos misterios y reflejaban el temperamento de la luna de manera extraña.					
				Samae nos invitó a sentarnos junto al fuego en la choza de piedra cuando quisiéramos, ya fuera para explorar los sueños o recobrar fuerzas.					
			Archetype/trifecta	Tenemos la sensación de que los dos Trigones restantes podrían estar perdidos en los sueños, o algo por el estilo.					
LOGFELLA_AFTERYELLOWBEAM	The Scythian			El leñador conocido como Amileño había regresado a cortar leña y parecía estar realmente concentrado.					
			triangle/Triangle	Amileño había visto el rayo ascendente en el bosque detrás del prado, así que le preguntamos sobre los secretos de la Arboleda Trigonal.					
				Nos contó una antigua historia que su gente solía contarles a sus hijos para asustarlos.					
			Archetype/trifecta	Amileño habló de una cuadrilla de Escitas que llegó hace muchas lunas a estas montañas olvidadas en busca de La Tríada Trigonal.					
			gourd/gourd	"""La cuadrilla había aprendido a buscar a los Espíritus Silvanos y enviarlos al cielo... y luego buscaron un lugar para realizar un milagro."""					
			Archetype/trifecta	"""La cuadrilla esperaba activar los tres rayos ascendentes en la Arboleda Trigonal, pero no sabían cuándo ni dónde estaban los Trigones."""					
				"""La cuadrilla vagó sin rumbo durante mucho tiempo por el antiguo camino hacia Mingi Tau... eventualmente se cansaron y decidieron detenerse."""					
				"""Entonces, la cuadrilla fue diezmada por un espectro inmortal a un costado del antiguo camino, donde todavía quedan algunas tumbas en la actualidad."""					
				Le dijimos a Amileño que era una historia interesante, aunque en realidad no nos asustó tanto.					
GIRL_GRAVESCOMPLETETHOUGHTS	Girl								
ARCHETYPE_MOONGROTTO	The Archetype			Veo que has logrado alterar el temperamento de la luna en la Gruta Lunar. Me pregunto cuánto durará esta paradoja temporal.					
MIRACLE2_ISLAND	The Scythian			Mientras la Luna Radiante se alza en el cielo, hemos llevado a cabo un extraño milagro lunar en una isla imposible en medio de un lago sereno.			136	073.jpg	W7A3K
MIRACLE2_PINKTRIGONCOLLECTED	The Scythian			Hemos obtenido El Trigón Luna Radiante, para nuestra gloria y desesperación. #trigontamed			155	068.jpg	56F8U
MIRACLE2_BRIGHTMOONTRIGONCOLLECTED	The Scythian			Quizás nos tentaba abandonar por completo este funesto cometido, pero había algo tan atractivo en el martirio.					
				Bueno, probablemente no importe mucho al final. Después de todo, el ingreso al Arremolinado Infinito no implica un examen físico.					
				Sentíamos claramente que todos estos paseos oníricos y domar Trigones comenzaban a cobrar su precio.					
				Cuando la luz y el sonido disminuyeron, nos encontramos en las orillas de un lago con un fuerte dolor de cabeza y la nariz ensangrentada.					
GIRL_BRIGHTMOONTRIGONCOLLECTED	The Scythian		Archetype/trifecta	Hablamos con Samae sobre nuestro encuentro onírico con El Trigón Luna Radiante y de nuestras intenciones de reconstruir La Tríada Trigonal.					
				Ella comentó que nuestro encuentro en sueños sonaba realmente genial y deseaba haber estado allí. #lies					
				Ella nos preguntó si habíamos pasado por la Arboleda Trigonal... ¿Quizás podríamos activar otro rayo ascendente?					
LOGFELLA_BRIGHTMOONTRIGONCOLLECTED	The Scythian			El leñador podía ver que nuestros paseos oníricos y la realización de milagros habían cobrado un gran costo en nuestra salud física.					
				Amileño parecía sospechar que nuestro funesto cometido probablemente no tendría un final feliz.					
				Amileño nos recordó que podíamos sentarnos junto al fuego de la choza y descansar de vez en cuando para recobrar fuerzas.					
ARCHETYPE_BRIGHTMOONTRIGONCOLLECTED	The Archetype			Nuestros datos de investigación muestran una alta correlación entre el progreso de un participante en S:S&S EP y su aptitud para ser genial.			45	074.jpg	87A43
				Veo que has logrado localizar y recuperar El Trigón Luna Radiante. Esto es realmente una noticia extraordinaria.					
MIRACLE3_HUGETREE	The Scythian			Mientras La Luna Sombría reina, hemos realizado un milagro en medio de un Parlamento de árboles.					
MIRACLE3_DARKMOONTRIGONCOLLECTED	The Scythian			Además... llevar El Megatomo a todas partes es algo molesto, es un libro realmente pesado en más de un sentido.					
				Nos sentíamos un poco mal... probablemente tenía algo que ver con todos esos rayos láser cósmicos.					
				Cuando la luz y el sonido disminuyeron, nos encontramos empapados por la fría lluvia en medio de un Parlamento de árboles.					
GIRL_DARKMOONTRIGONCOLLECTED	The Scythian		Archetype/trifecta	Hablamos con Samae sobre nuestro encuentro onírico con El Trigón Luna Sombría y de nuestras intenciones de reconstruir La Tríada Trigonal.					
				Le contamos cómo habíamos neutralizado el odioso ataque arcoíris de El Trigón Luna Sombría y ella simplemente dijo «genial».					
				No parecía importarle escuchar nuestras historias extravagantes.					
LOGFELLA_DARKMOONTRIGONCOLLECTED	The Scythian			El leñador podía ver que nuestros paseos oníricos y la realización de milagros habían cobrado un gran costo en nuestra salud física.					
			Archetype/trifecta	Amileño nos preguntó si habíamos visitado a Amican en la Arboleda Trigonal... ¿Quizás podríamos activar otro rayo ascendente?					
ARCHETYPE_DARKMOONTRIGONCOLLECTED	The Archetype			Ahora la pregunta es... ¿Qué sigue?					
				A pesar de la escasez de información útil que hemos proporcionado, has logrado dominar a El Trigón Luna Sombría.					
				Me han informado que has recuperado El Trigón Luna Sombría. Esto es realmente una noticia extraordinaria.					
LOGFELLA_FOUNDBOORKEY	The Scythian		AdventureUI/keyItem	El leñador no reconoció la llave que encontramos y no tenía ni idea de para qué servía.					
			AdventureUI/keyItem	¿...?					
GIRL_FOUNDBOORKEY	The Scythian		AdventureUI/keyItem	Samae vio la llave que encontramos y nos animó a estar atentos a una puerta cerrada.					
				Ella no tenía ninguna otra idea, pero recordamos algo que habíamos visto en el antiguo camino hacia Mingi Tau.					
ARCHETYPE_GROTTOPARADOX	The Archetype								
				El temperamento de la luna ha sido alterado en la Gruta Lunar					
ARCHETYPE_KILLBOOR	The Archetype			Ahora, me imagino que te preguntarás para qué sirve esa llave. Para ser honesto, no tengo ni idea.			119	075.jpg	87C5S
				No es que esté sugiriendo que en realidad seas un sociópata violento... jeje... Estoy seguro de que tenías tus razones, ¿Verdad? #thegrizzledboor					
				Debo mencionar que el Tosco Pardo fue incluido en S:S&S EP para tentar a los participantes a identificarse como sociópatas violentos.					
				Me han informado que el Tosco Pardo ha sido asesinado... ¿Sabes algo al respecto? #slaughter					
ARCHETYPE_SPAREBOOR	The Archetype			Ahora, me imagino que te preguntarás para qué sirve esa llave. Para ser honesto, no tengo ni idea.			119	075.jpg	87C5S
				¡Así es, eso es genial y te queremos mucho por ello!					
				El Tosco Pardo fue incluido en S:S&S EP para permitir que los participantes se identificaran a sí mismos como personas compasivas y razonables.					
				Me han informado que el Tosco Pardo ha podido escapar ileso. Esta es una noticia alentadora.					
LOGFELLA_FOUNDATION	Logfella			...					
				...					
				...					
SCYTHIAN_FOUNDATION	The Scythian			Despertamos a un espíritu silvano en un estanque profundo con lirios junto a una choza de piedra. No sabemos qué significa.					
				Con una tormenta incesante hemos aprendido a cantar la Canción de Espadamancia y convocar a un espíritu silvano dormido.					
				Espera... ¿Por qué me estoy refiriendo a mí misma en primera persona? ¿No se supone que nuestra historia se cuenta en segunda persona? #editingoversight					
				¿Mis pensamientos están ordenados cronológicamente, en el orden en que los pensé? ¿Así que esto es lo que estaba pensando hace unos segundos?					
				¿Esto es El Megatomo? ¿Absorbe 'transmisiones de pensamiento lingüístico'? ¿Estoy leyendo mis pensamientos mientras los estoy pensando? Hmm...					
GIRL_FOUNDATION	Girl			...					
				...					
				...					
DOGFELLA_FOUNDATION	Dogfella			...					
				...					
				...					
LOGFELLA_DARKMOON	The Scythian			El leñador habló sobre paseos oníricos por el bosque en la hora antes del amanecer, bajo un cielo oscuro y tormentoso.					
				Mencionó una inquietante luz rosada y una misteriosa canción que surgían del bosque sin nombre detrás del prado.					
				Supusimos que Amileño se refería probablemente al concierto de rock de La Luna Sombría.					
GIRL_DARKMOON	The Scythian			Samae habló sobre paseos oníricos por el bosque en la hora antes del amanecer, bajo un cielo oscuro y tormentoso.					
				Comentó cómo se había refugiado de la tormenta en un árbol hueco de proporciones titánicas.					
				Sabíamos exactamente a qué árbol hueco titánico se refería.					
ARCHETYPE_DARKMOON	The Archetype			Ten cuidado. La Luna Sombría reina.			94	076.jpg	I7F69
LOGFELLA_CRESCENTWAX	The Scythian			El leñador habló sobre paseos oníricos por el bosque en la hora antes del amanecer, bajo la luz de una luna creciente.					
				Habló acerca de una criatura que había encontrado, algo o alguien extraño y desnudo. ¿Era un oso? ¿Un hombre? o... ¿El Tosco Pardo?			57	077.jpg	I7G7U
GIRL_CRESCENTWAX	The Scythian			Samae estaba emocionada, ¡Hoy comenzaba un nuevo mes lunar! Le esperaban largos días sentada sobre rocas.					
ARCHETYPE_CRESCENTWAX	The Archetype			Un destello de luna creciente ha aparecido, marcando el inicio de un nuevo ciclo lunar de veintiocho días.			118	045.jpg	Y4E5Q
LOGFELLA_HALFWAX	The Scythian			El leñador admitió que sí, de hecho, había cortado una cantidad decente de leña a tiempo.					
				Habló de fríos inviernos y profundas nevadas aquí, en las majestuosas montañas del Cáucaso, que se alzaban sobre las estepas de Escitia.					
				El leñador esperaba tener suficiente comida y leña para sobrevivir los largos y fríos meses venideros.					
GIRL_HALFWAX	The Scythian			En mi sueño de anoche, estaba caminando por el bosque y tenía un antojo terrible de un muffin, pero no había ni uno solo.			108	078.jpg	07D87
ARCHETYPE_HALFWAX	The Archetype			Algunos folcloristas lunáticos han afirmado que no existe una relación causal entre la locura y el temperamento de la luna.					
LOGFELLA_ALMOSTWAX	The Scythian			El leñador dijo que nunca solía pensar demasiado en La Masa Gogolítica y en la montaña desierta de Mingi Tau.					
				Sin embargo, mencionó que últimamente la presencia espectral de La Masa Gogolítica había comenzado a acosarlo.					
				El leñador admitió que se le ponía la piel de gallina cuando La Luna Radiante se asomaba... y cuando La Luna Sombría reinaba.					
GIRL_ALMOSTWAX	The Scythian			La chica comentó algo sobre la luna creciente y se preguntó cuánto tiempo pasaría hasta que La Luna Radiante se alzara en el cielo.					
ARCHETYPE_ALMOSTWAX	The Archetype			La luna crece un poco cada día... en unos pocos días, La Luna Radiante se alzará... ¿Y qué?			165	046.jpg	P4B6A
LOGFELLA_BRIGHTMOON	The Scythian			El leñador admitió que su perro se comportaba de manera extraña cada vez que La Luna Radiante se asomaba en el cielo.			135	061.jpg	M6F1I
GIRL_BRIGHTMOON	The Scythian			Samae habló sobre paseos oníricos por el bosque en la hora antes del amanecer, con La Luna Radiante asomándose en el cielo.					
				Mencionó el aire fresco de la mañana y una isla imposible en medio de un lago sereno.					
ARCHETYPE_BRIGHTMOON	The Archetype			Sal afuera y mira hacia arriba. ¡Maravíllate con La Luna Radiante que se cierne en el cielo!			95	079.jpg	07D95
LOGFELLA_ALMOSTWANE	The Scythian			El leñador tenía poca paciencia para el folclore y admitió que normalmente lo adormecía, aunque poseía un buen conocimiento al respecto.					
				El leñador era conocedor de todos los detalles sobre Mingi Tau y por qué era conocido como el Reino de las Nubes.					
				Era consciente de que Mingi Tau era la montaña más alta del mundo conocido, incluso más alta que el Monte Olimpo, donde habitaban los dioses aqueos.					
				Asimismo, sabía que la cima de Mingi Tau, siempre envuelta en nubes, era considerada la entrada al Arremolinado Infinito.					
				El leñador nunca se había atrevido a poner un pie en las temibles laderas de Mingi Tau, y nunca lo haría.					
GIRL_ALMOSTWANE	The Scythian			Samae se preguntó por qué tantos hongos crecían justo antes y después de La Luna Radiante... ¿A qué se debería?					
ARCHETYPE_ALMOSTWANE	The Archetype			La luna está ligeramente menos brillante que ayer y el ciclo lunar está comenzando a disminuir.					
LOGFELLA_HALFWANE	The Scythian			El leñador tenía poca paciencia para el folclore y admitió que normalmente lo adormecía, aunque poseía un buen conocimiento al respecto.					
				El leñador explicó que en Escitia y Persia, Mingi Tau era conocida como La Montaña Eterna.					
				El leñador relató cómo, hace siglos, una raza olvidada había tallado un templo en la roca bajo Mingi Tau.					
				El leñador mencionó los corredores subterráneos y los espacios cavernosos tallados en la roca bajo Mingi Tau.					
				Según el leñador, esos espacios cavernosos fueron tallados hace siglos para proteger El Megatomo.					
GIRL_HALFWANE	The Scythian			Samae dijo haber caminado más allá del muro de piedra y haber sentido la terrible presencia de La Masa Gogolítica.			30	080.jpg	V8B04
ARCHETYPE_HALFWANE	The Archetype			El ciclo lunar está disminuyendo y La Luna Sombría está a poco menos de una semana de distancia.					
LOGFELLA_CRESCENTWANE	The Scythian			El leñador tenía poca paciencia para el folclore y admitió que normalmente lo adormecía, aunque poseía un buen conocimiento al respecto.					
				El leñador conocía a La Masa Gogolítica, el espectro inmortal que acechaba en la oscuridad debajo de Mingi Tau.					
				Amileño habló del Arremolinado Infinito, más allá de nuestra comprensión, de donde provenía El Megatomo en la apenas recordada Edad de Piedra.					
				Habló de una raza de seres inmortales del espacio que despertaron en la humanidad una forma rudimentaria de transmisión de pensamiento lingüístico.					
				"""Estos inmortales bendijeron a la humanidad con la capacidad de ser una civilización, y por lo tanto, los condenaron a una extinción eventual e inevitable."""					
				"""Los escitas trataron de reprimir la insidiosa propagación de la civilización y por eso aislaron El Megatomo con su protector inmortal."""					
				"""El inmortal ha acechado en la oscuridad desde entonces, deteriorándose para convertirse en un espectro inmortal conocido como La Masa Gogolítica."""					
				El leñador probablemente habría continuado con esta historia sin fin si no lo hubiéramos detenido de manera respetuosa.					
