id	user	icon	portrait	English	Japanese	Final Notes	pic	Filenames	Codes
ARCHETYPE_CREDITS	The Archetype								
				S:S&S EP es un proyecto colaborativo tipo videojuego creado en Toronto de 2009 a 2011, en internet en swordandsworcery.com.					
			Logos/superbrothers	Concepto original de la organización de arte y diseño Superbrothers A/V Inc. en superbrothersHQ.com.					
				Canciones y algunos sonidos por el amado compositor y rockero Jim Guthrie en jimguthrie.org.					
			Logos/capy	Ingeniería y milagros por el estudio independiente de videojuegos Capy en capybaragames.com.					
			Logos/eightfour	Localización japonesa, marketing, relaciones públicas y cariño por 8-4, Ltd. TODO EL EQUIPO en 8-4.jp.					
				* * * EL EQUIPO de S:S&S EP * * *					
				Concepto, arte, diseño, dirección y escritura por representantes en Superbrothers A/V Inc.					
				Diseño, liderazgo de proyecto, apoyo incansable y más: Kris Piotrowski, director creativo en Capy.					
				Sistemas, arquitectura técnica, UI, motor y más: Jon Maur, programador técnico principal de S:S&S EP en Capy.					
				Scripting, combate y milagros: Frankie Leung, programador de jugabilidad principal de S:S&S EP en Capy.					
				Inspiración, canciones, sonidos, alma y mucho más: Jim Guthrie, compositor, héroe del folk y rockero.					
				* * * ADEMÁS * * *					
				Voz de Tronquero: Robert Ashley, creador del programa de radio A Life Well Wasted en alifewellwasted.com.					
				Voz de La Escita: la fotógrafa Robyn Cumming en robyncumming.com.					
				Voz de El Arquetipo: el artista y cineasta Clive Holden en cliveholden.com.					
				Sonidos cósmicos de la Gruta Lunar: Scientific American en scntfc.com.					
				* * * APOYO DE CAPY * * *					
				Productor ejecutivo, héroe del pueblo, liderazgo y estrategia: Nathan Vella, presidente de Capy.					
				Productor de PC, asistencia técnica de audio, integración FMOD y muchísimos sonidos: Sean 'Uber' Lohrisch, cofundador de Capy.					
				Produc-trón de Nintendo Switch y asistencia general de negocios: Matt Repetski, cofundador de Capy.					
				Control de calidad y mega-héroe de pruebas: Christian 'Sea Dawg' Meyer en Capy.					
				Programación principal para versión Nintendo Switch y computadoras de hogar proporcionada por nada menos que Hubert Wong en Capy.					
				Conceptos de diseño, implementación y brujería de Nintendo Switch preparados por Sadie Lee en Capy.					
				Trabajo pesado variado incluyendo programación PC/Mac/Linux y soporte de Nintendo Switch por Drew Grainge en Capy.					
				Algunos recursos de arte redimensionados y sonrisas proporcionadas por Vic 'Meow' Nguyen en Capy.					
				Control de calidad adicional: el único e inigualable Aaron Eves.					
				Soporte de QA de Nintendo Switch cortesía de Testronic Labs.					
				Soporte de QA por Roopesh Pawar. A, Prashanth. DR, Veeresh Kuruva, Raghunath. BG y Roshan R Shekar de Sun technology Integrators Pvt. Ltd.					
				Gracias a Xavier Xaden Xen, Joseppe Theodore Blocco y Hank Hudson.					
				Galletas y otras delicias proporcionadas por Thea Gaerlan.					
				* * * APOYO DE SUPERBROTHERS * * *					
				Amor cósmico eterno a Jori.					
				Felicitaciones al CEO de Superbrothers, Mack.					
				Un enorme agradecimiento a Jim Guthrie por embarcarse en esta aventura lunática hacia lo desconocido.					
				Sonidos adicionales de un millón de dólares cortesía de Timothy Muirhead.					
				* * * APOYO DE 8-4 * * *					
				Traducción japonesa: el maestro de las palabras RYUTA YAZAWA.					
				Edición japonesa, consejos cruciales y apoyo infinito: MASAHIRO YUKI de Grasshopper Manufacture grasshopper.co.jp.					
				Soporte adicional de localización japonesa proporcionado por Yutaka Ohbuchi, John Ricciardi y Masanobu Suto.					
				Diseño del increíble logo japonés cortesía de POLYGRAPH en polygraph.jp.					
				Magia web japonesa por Jonathan Lumb en jonnyram.com.					
				Y finalmente, agradecimiento por apoyo y amistad de Japón: Suda 51, Tomoaki Takahashi, Hideto Yamada...					
				Y los artistas de remix: Baiyon, Akira Yamaoka, Michiru Yamane, macotom3 y Decassegui Hip.					
				* * * EL DOMINIO DE CANADÁ * * *					
			Logos/omdc	Este proyecto fue posible gracias al apoyo financiero de Ontario Creates.					
				* * * LOS QUEREMOS MUCHÍSIMO * * *					
				¡Un grito a todos los que alinearon las estrellas!					
				Mucho amor a las increíbles comunidades indie de videojuegos de Toronto y a la gente encantadora de The Hand Eye Society, TOJam y Gamercamp.					
				A todos los que han apoyado este proyecto: gracias.					
				* * * PROCESO * * *					
				Arte de píxeles creado íntegramente en Promotion de Cosmigo; otros elementos visuales en Illustrator y Photoshop de Adobe.					
				Sonidos y canciones creados con MTV Music Generator de Codemasters para PSOne y/o Garageband y Logic Studio de Apple.					
			Logos/FMOD	Sonidos y canciones integrados al proyecto usando FMOD de Firelight Technologies.					
				Dolby y el símbolo de doble D son marcas comerciales de Dolby Laboratories.					
				Se requiere solución de audio para PC que contenga Dolby® Digital Live para audio Dolby Digital.					
				DTS® y DTS Digital Surround® son marcas comerciales registradas de DTS, Inc.					
				Código programado en C++ y Lua script con tolua++. Mapas y elementos del mundo con herramientas propietarias de Capy.					
				Cálculo de fases lunares y algoritmos astronómicos: voidware.com/moon_phase.htm					
				APIs utilizadas en la creación de S:S&S EP incluyen tinyxml, libpng/zlib, SDL, cmake y minizip.					
				Una versión absurdamente temprana se envió al Independent Games Festival el 1 de noviembre de 2009.					
				S:S&S EP se anunció el 1 de diciembre de 2009.					
				A principios de 2010 se anunció que el proyecto había ganado el premio 'Achievement in Art' del IGF Mobile.					
				La primera demostración pública en vivo de S:S&S EP ocurrió en un evento social de Hand Eye Society en Toronto el 14 de febrero de 2010.					
				La primera versión jugable de S:S&S EP se presentó a asistentes y amigos en la GDC 2010 en San Francisco del 9 al 13 de marzo de 2010.					
				Las primeras imágenes de jugabilidad sin editar de la versión GDC 2010 aparecieron simultáneamente en línea.					
				'Less Talk, More Rock: The Native Language of Videogames' se publicó en línea en Boing Boing en marzo de 2010 y puedes buscarlo en Google.					
				'The Intoxication of Mythology' se presentó por un representante de Superbrothers el 22 de septiembre de 2010 en Fantastic Arcade de Austin.					
				'Aiming for Audiovisual Alchemy' se presentó por Jim Guthrie, Kris Piotrowski y un representante de Superbrothers en Gamercamp de Toronto.					
				Se publicó un nuevo clip titulado 'Audience Calibration Procedure' el jueves 24 de febrero de 2011 para iniciar el lanzamiento.					
				S:S&S EP finalmente estuvo disponible para iPad, iPhone e iPod Touch cerca del equinoccio de primavera de 2011.					
				Organizamos MIDSUMMER ROCKSHOWCASE en TIFF Lightbox de Toronto presentando material de S&S en vivo de Jim Guthrie - fue realmente agradable.					
				* * * SIETE AÑOS DESPUÉS * * *					
				Desde entonces, Jim Guthrie ha proporcionado música para varios videojuegos y películas, además de lanzar algunos discos.					
				Capy continúa su búsqueda constante en la creación de videojuegos extraños y maravillosos.					
				El personal de Superbrothers A/V Inc se toma su tiempo para soñar nuevos sueños.					
				S:S&S EP fue uno de los 'Top 10 Videojuegos de 2011' de la revista Time.					
				La partitura musical de Jim Guthrie fue reconocida como 'La Mejor Música de Videojuegos de 2011' por Kirk Hamilton en Kotaku.					
				S:S&S EP ganó un Game Developer's Choice Award en GDC 2012.					
				* * * DOCE AÑOS DESPUÉS * * *					
				S:S&S EP fue desempolvado y actualizado para asegurar que el juego siguiera funcionando en los últimos sistemas operativos.					
				Superbrothers, un pequeño estudio de arte y videojuegos en su 20º año, opera desde los bosques de Quebec y la costa oeste de Canadá.					
				Desde S:S&S EP, Superbrothers y Jim Guthrie contribuyeron a Sound Shapes (2012) (Queasy Games) (PS + PC).					
				Superbrothers soñó nuevos sueños y entregó JETT: The Far Shore + Given Time (2021/23) (PS + PC), una saga de ciencia ficción con música de scntfc.					
				A partir de 2023, un nuevo proyecto de píxeles se gesta en Superbrothers.					
				Capy Games lanzó el hiperactivo rebobinador de tiempo Super Time Force Ultra (2014) (PS + PC + Xbox).					
				En 2018, Capy entregó Below, un roguelike de acción-aventura sobre un guerrero explorando las profundidades de una isla remota (PS + PC + Xbox).					
				Capy lanzó el maravilloso Grindstone en 2019 y continúa añadiendo contenido para los jugadores (Apple Arcade + Switch + PC + PS + Xbox).					
				Mientras tanto, a partir de 2023, el equipo está cocinando un delicioso nuevo juego en su caldero de juegos.					
				* * * ¿QUÉ ES S:S&S EP? * * *					
				S:S&S EP pretende ser un valiente experimento en Cine Interactivo, sea lo que eso signifique.					
				S:S&S EP es un enfoque fresco al videojuego de aventura old school con énfasis en el estilo audiovisual.					
				S:S&S EP se inspira en el trabajo de creadores pioneros de videojuegos Shigeru Miyamoto, Jordan Mechner, Eric Chahi y Fumito Ueda.					
				S:S&S EP es un sueño febril de famicom.			38	082.jpg	28B24
				S:S&S EP ha sido construido con la psicocosmología mitopoética de las historias de espada y hechicería de Robert E. Howard en mente.					
				S:S&S EP es un 'Link' al pasado.			167	083.jpg	18E3V
				S:S&S EP es un primer esfuerzo y sí, es un poco experimental.					
				El concepto estético de S:S&S EP es 'la aventura arquetípica de videojuego'.					
				S:S&S EP referencia oblicuamente a Carl G. Jung y su fascinante 'Libro Rojo' por todo el maldito lugar.					
				S:S&S EP es una cosita ingeniosa que realmente no entiendo pero que creo que todos deberían jugar.					
				S:S&S EP es un haiku crudo de videojuego sobre la vida, el amor y la muerte.					
				S:S&S EP es un corte selecto de mitos y sueños.					
				S:S&S EP fue creado pensando en un público amplio y culto.					
				S:S&S EP iba a llamarse 'Poopsock' originalmente. Esto es realmente cierto.					
				* * * SE ACABÓ * * *					
				Ahora somos amigos cósmicos para siempre, ¿ok?			87	084.jpg	L8A48